,stop,alightings
870,New Carrollton Station - Arrival,11462.0
167,Addison Rd Metrorail - Arrival,9163.0
601,Greenbelt Metro Station (Arrival),7848.0
1207,Suitland Metro - Arrival,7550.0
867,Naylor Rd Station Bay H - Hidden Arrival,7424.0
853,Morgan Blvd Metro Station,6296.0
1152,Southern Ave Station Bay E - Arrival,5179.0
403,Campus Way South at College Station Dr (PGCC),5108.0
781,Largo Town Center Station,5094.0
316,Branch Ave Station - Arrival,4726.0
871,New Carrollton Station Bay F,4295.0
410,Capitol Heights - Arrival,4123.0
1294,Woody Terrace at Woodyard Rd,3850.0
1286,West Hyattsville Station,3784.0
421,Capitol Heights Station Bay B,3631.0
602,Greenbelt Metro Station Bus Bay A,3345.0
501,County Administration Building,3089.0
1150,Southern Ave Metro Rail Station at Bus Bay F,3040.0
746,Landover Metrorail Station - Arrival,3023.0
782,Largo Town Center Station at Bus Bay E,3012.0
168,Addison Rd Metrorail Station,2993.0
477,Clinton Fringe Lot,2822.0
701,Iverson Mall,2272.0
1213,Suitland Rd at Shadyside Ave,2268.0
466,Cheverly Station Bay D,2191.0
744,Landover Mall,2187.0
1288,West Hyattsville Station - Arrival,2098.0
836,Mattawoman Beantown Rd at Pinefield Center,2052.0
290,Belcrest Rd at PG Plaza Metrorail,1994.0
478,Clinton Fringe Parking Lot,1962.0
502,County Courthouse,1910.0
1287,West Hyattsville Station (Arrival),1784.0
354,Brightseat Rd at Maple Ridge Apts,1609.0
894,Old Branch Ave at Coventry Way,1587.0
409,Capitol Crossing Apts,1560.0
451,Cherrywood Ln at Greenbelt Federal Courthouse,1558.0
891,Old Branch Ave at Allentown Way,1558.0
1118,SOUTHERN AVENUE METRO STATION & BUS BAY K,1534.0
508,Courthouse,1484.0
1223,Takoma Langley Park Transit Center Bus Bay B (hidden arrival),1478.0
75,4192 Whitehall Square Apts,1434.0
620,Greenway Center,1431.0
480,College Park Metro Station at Bus Bay B,1386.0
842,McCormick Dr at Basil Ct,1349.0
1301,Woodyard Rd at Pine View Ln,1346.0
559,Equestrian Center Lot 4,1339.0
716,Judge's Dr at Pratt St,1324.0
971,Padgett's Corner,1310.0
1090,Riverdale Rd at Carrollton Mall,1262.0
289,Belcrest Rd at PG Plaza Entrance,1236.0
208,Allentown Rd at Temple Hill Rd,1233.0
582,Garrett A. Morgan Blvd at Morgan Blvd Station,1225.0
532,Doctors Community Hospital,1207.0
558,Equestrian Center Lot 3,1196.0
628,Hamilton St at 31st Ave,1172.0
693,Ikea at Bus Bay 2,1132.0
245,Auburn Ave at Riverdale Rd,1128.0
481,College Park Station,1102.0
1016,RUBY LOCKHART BLVD AT CAMPUS WAY NORTH,1088.0
896,Old Forestville Rd at Forestville Rd,1088.0
869,New Carrollton Station (Arrival),1084.0
857,Mt Rainier Terminal - Arrival,1076.0
539,Donnell Drive at Target Store,1073.0
367,Brinkley Rd at Huntcrest,1054.0
849,Mercantile Ln at Technology Way,1001.0
197,Allentown Rd at Brinkley Rd,994.0
1199,St Clair Dr at 28th Ave,969.0
548,East-West Hwy at Metro Center Dr,952.0
408,Campus Way at PGCC Perimeter Rd,949.0
220,Annapolis Rd at 85th Ave,948.0
1059,Ritchie Rd at Forest Park Dr,937.0
537,Donnell Dr at Pennsylvania Ave,936.0
964,PG Plaza Station,909.0
919,Old Silver Hill Rd at Library,903.0
983,Peppermill Dr at Hastings Dr,883.0
1088,Riverdale Rd at 67th Ave,874.0
86,42nd Ave at Oglethorpe St,872.0
856,Motor Vehicle Administration - Arrival,871.0
1230,Temple Hill Rd at Farmer Dr,866.0
1188,Springhill Ln at Springhill Dr,861.0
196,Allentown Rd at Allentown Way,859.0
816,Mandan Rd at Hanover Pkwy,856.0
465,Cheverly Metrorail Station Bay D,851.0
318,Branchwood Towers,850.0
743,Lamont Dr at Westbrook Dr,850.0
966,PG Sports Complex,848.0
997,Prince George's Plaza Entrance,827.0
1081,Riverdale Rd at 57th Ave,827.0
452,Cherrywood Ln at Greenbelt Rd (MD. RTE. 193),799.0
1146,Silver Hill Rd at Pennsylvania Ave,797.0
948,Oxon Hill Rd at Oxon Hill Fringe Parking Lot,796.0
606,Greenbelt Rd at Opp. Greenbelt Center,794.0
970,PGCC Perimeter Rd at Largo Rd,791.0
996,Prince George's Plaza - Arrival,789.0
1211,Suitland Rd at Huron Ave,773.0
522,Denise Dr at Dutton Way,766.0
809,MONUMENT AVE @ MGM CASINO,742.0
1246,Temple Hill Rd at St Barnabas Rd,740.0
903,Old Marlboro Pike at John Rogers Blvd,739.0
591,Good Luck Rd at Crest Park Dr,734.0
1172,Southern Ave at Wheeler Rd,723.0
1285,Walker Mill Road at Marlboro Pike,711.0
604,Greenbelt Rd at Greenway Center,690.0
963,PG Plaza,681.0
504,County Rd at Elmhurst St,679.0
1184,Springhill Dr at Springhill Ln,679.0
511,Crescent Rd at Gardenway,673.0
386,Brooks Dr at Pennsylvania Ave,659.0
368,Brinkley Rd at Huntley Square Dr,658.0
1185,Springhill Ln at Breezewood Ct,656.0
98,5401 85th Ave,645.0
181,Addison Rd at Walker Mill Rd,638.0
650,Hanover Pkwy at Ora Glen Dr,630.0
985,Piscataway Rd at Absher Ln,628.0
1300,Woodyard Rd at Pine View Lane,627.0
979,Pennsylvania Ave at Penn Crossing Dr,623.0
741,Lamont Dr at Powhatan St,623.0
1175,Southern Maryland Hospital (Hidden Arrival),621.0
40,3209 75th Ave,619.0
1250,Timothy Branch Drive @ Safeway,617.0
244,Auburn Ave at Chestnut Ave,611.0
84,42nd Ave at Madison St,611.0
1186,Springhill Ln at Breezewood Dr,610.0
646,Hanover Pkwy at Hanover Dr,610.0
629,Hamilton St at 31st Ave - in,607.0
561,Fairlawn St at Colebrooke Dr,605.0
1253,Toledo Rd at Belcrest Rd,602.0
340,Brightseat Rd at Ardwick-Ardmore Rd,600.0
1212,Suitland Rd at Opposite Prem. #4211,599.0
360,Brinkley Rd at Brinkley House W Ent,594.0
1200,St George Blvd at Waterfront St,588.0
573,Forestville Rd at Parston Dr,582.0
600,Greenbelt Metro Dr at Cherrywood Ln,569.0
1072,Ritchie Station Court Bus Stop #1,569.0
1201,Stars Entrance Gaylord Hotel at National Harbor Blvd,557.0
819,Marlboro Pike at County Rd,557.0
71,4112 Whitehall Square Apts,538.0
1226,Temple Hill Rd at Allentown Rd,534.0
533,Dodge Park Rd at Hubbard Rd,534.0
22,23rd Ave at Lewisdale Dr,528.0
1210,Suitland Rd at Homer Ave,527.0
1289,Whitehall Square Apts at Community Hall,525.0
178,Addison Rd at Ronald Rd,522.0
1160,Southern Ave at Chesapeake St SE,514.0
745,Landover Metrorail Station,513.0
736,Lamont Dr at Carrollton Pkwy,511.0
1222,Takoma Langley Park Transit Center Bus Bay B,507.0
389,CAB - Arrival,506.0
72,4138 Whitehall Square Apts - in,498.0
169,Addison Rd at Adak St,493.0
703,Jefferson St at Kenilworth Ave,486.0
938,Oxon Hill Fringe Parking Lot Bus Bay B,481.0
855,Motor Vehicle Administration,481.0
1242,Temple Hill Rd at Portal Ave,475.0
1147,Silver Hill Rd at Randall Rd,470.0
683,Hubbard Rd at Martin Luther King,470.0
314,Bock Rd at Technology Recreation Complex,468.0
1209,Suitland Rd at 4412 Suitland Rd,466.0
990,Piscataway Rd at Pella Place,466.0
1001,Queens Chapel Rd at Hamilton St,460.0
838,Mattowoman Beantown Rd at MTA Park and Ride Lot (Arrival),458.0
840,Maxwell Dr at Morris Ave,455.0
79,4258 Whitehall Square Apts,455.0
1180,Southway at Crescent Rd,443.0
1091,Riverdale Rd at Eastpine Dr,442.0
759,Lansdowne Village Apts,432.0
920,Old Silver Hill Rd at Parkland Ct (E),427.0
257,Baltimore Ave at Berwyn House Rd,426.0
202,Allentown Rd at Kingston Dr,426.0
1243,Temple Hill Rd at Rickey Ave,424.0
238,Ashwood Dr at Dunmore Pl,423.0
203,Allentown Rd at Old Branch Ave,422.0
28,28th Ave at Keating St,418.0
626,Gwynn Park High School,417.0
1293,Wmap Rd at Icesat Rd,405.0
439,Central Ave at Soper Ln,403.0
479,Clinton Manor,401.0
592,Good Luck Rd at Dawnwood Dr,400.0
978,Pennsylvania Ave at Old Marlboro Pl,399.0
541,Dunmore Pl at Edgeworth Dr,398.0
336,Breezewood Dr at Cherrywood Ter,398.0
698,Indian Head Highway at Audrey Ln,395.0
737,Lamont Dr at Donoghue Dr,393.0
475,Cipriano Rd at Brae Brooke Dr,393.0
14,16th Ave at Cypress Creek Dr,393.0
381,Brinkley Rd at Temple Hill Rd,390.0
644,Hanover Pkwy at Greenbrook Dr,390.0
1020,Raleigh Rd at Culver St,386.0
472,Chillum Rd at Longford Dr,386.0
1130,Sheriff Rd at Dutch Village Dr,383.0
474,Chillum Rd at Shoppers Food,383.0
651,Hanover Pkwy at Prem # 7718,381.0
888,Old Alexandria Ferry Rd at Woodyard Rd,380.0
534,Dodge Park Rd at Landover Rd,378.0
637,Hampton Park Boulevard at Alaking Ct,377.0
387,Brooks Drive at Ridley Street,375.0
211,Allentown Rd at Westchester Ct,374.0
728,Kipling Pkwy at Marlboro Pike,372.0
1187,Springhill Ln at Market Ln,371.0
557,Equestrian Center Lot 1 (Arrival),366.0
923,Olson St at Norcross St,366.0
768,Largo Rd at Hancock Dr,364.0
396,Campus Way North at Grey Gables Ct,361.0
1183,Springhill Dr at Cherrywood Ln,360.0
730,Kipling Pkwy at Wintergreen Ave,357.0
893,Old Branch Ave at Arbutus Ln,357.0
976,Pennsy Drive at Landover Metro Station,356.0
1259,University Blvd at Riggs Rd,354.0
549,East-West Hwy at Toledo Ter,354.0
995,Possum Ct at Walker Mill Dr,353.0
545,East Capitol St at Yost Pl,352.0
198,Allentown Rd at Camp Springs Ave,351.0
1022,Raleigh Rd at St Barnabas Rd,350.0
1054,Ritchie Rd at Central Ave,350.0
402,Campus Way South at Central Ave,349.0
492,Columbia Park Rd at South Club Dr,347.0
509,Coventry Way at Old Alexandria Ferry Rd,346.0
420,Capitol Heights Station,346.0
1053,Ritchie Rd at Ashville Rd,345.0
1061,Ritchie Rd at Mane Ln,345.0
13,15th Ave at University Blvd,343.0
490,Columbia Park Rd at Marshall Pl,342.0
854,Morris Ave at Maxwell Dr,341.0
587,Goddard Space Flight Center Main Gate (Southbound),341.0
1026,Ray Rd at Madison St,341.0
531,District Heights Pkwy at Rochelle Ave,339.0
1070,Ritchie Rd at Vineyard Dr,338.0
406,Campus Way South at PGCC Perimeter Rd,338.0
939,Oxon Hill Fringe Parking Lot at Bus Bay F,337.0
944,Oxon Hill Rd at John Hanson Ln,334.0
30,28th Ave at Kenton Pl,334.0
299,Benning Rd at Drum Ave,334.0
25,2400 Chillum Rd,334.0
49,34th St at Otis St,333.0
467,Chillum Rd at 18th Ave,331.0
639,Hampton Park Boulevard at Edgeworth Dr,329.0
633,Hamilton St at 38th Ave,329.0
790,Lottsford Rd at Zachery St,325.0
1196,St Barnabas Rd at Raleigh Rd,322.0
335,Breezewood Dr at Cherrywood Ln,319.0
977,Pennsylvania Ave at Forestville Rd,319.0
571,Fisher Rd at St. Moritz Dr,318.0
287,Belcrest Rd at 6505 Belcrest Rd,318.0
1068,Ritchie Rd at Roslyn Ave,317.0
832,Marlboro Pike at Walters Ln,312.0
53,38th St at Bunker Hill Rd,312.0
1252,Toledo Rd at Adelphi Rd,310.0
241,Auburn Ave at 1st St,308.0
1279,Walker Mill Drive at Shady Glen Drive,306.0
872,New Carrollton Station Bay K,305.0
1093,Riverdale Rd at Heritage Square Apts,304.0
739,Lamont Dr at Lamont Pl,304.0
719,Kenilworth Ave at Nicholson St,304.0
105,5846 ALLENTOWN WAY,302.0
1179,Southway at 7 Court,300.0
858,Nalley Rd at Capital View Dr,299.0
789,Lottsford Rd at McCormick Dr,299.0
136,9400 Peppercorn Pl,298.0
801,MLK Jr Hwy at Columbia Park Rd,297.0
753,Landover Rd at Annapolis Rd,297.0
100,5600 54th Ave,296.0
1042,Rhode Island Ave at Mt Rainier,296.0
385,Brooks Dr at Marlboro Pike,295.0
1168,Southern Ave at Park Southern Apts,294.0
377,Brinkley Rd at Rose Croft Shopping Center,294.0
1249,Temple Hill Rd at Weldon Dr,294.0
847,McCormick Dr at UMUC (opposite),293.0
1148,Silver Hill Rd at Suitland Rd,293.0
222,Annapolis Rd at Edmonston Rd,291.0
1087,Riverdale Rd at 64th Ave,290.0
638,Hampton Park Boulevard at East Hampton Dr,290.0
1065,Ritchie Rd at Ritchie Dr,290.0
1170,Southern Ave at Southview Dr,287.0
860,Nalley Rd at East Nalley Rd,287.0
778,Largo Rd at Watkins Park Dr,286.0
99,54th Ave at Jefferson St,285.0
942,Oxon Hill Rd at 6246 Oxon Hill Rd,282.0
507,County Service Building,282.0
793,MLK Jr Hwy at 65th Ave,281.0
89,4412 Suitland Rd (Opposite),280.0
640,Hampton Park Boulevard at Hampton Mall Dr,279.0
761,Largo Rd  at Water Foul Way,278.0
1127,Sheriff Rd at Belle Haven Dr,278.0
224,Apollo Dr at Arena Dr,278.0
722,Kipling Pkwy at Brewton St,277.0
1024,Ray Rd at Cypress Creek Dr,275.0
334,Brandywine Road at Surrats Road,274.0
1277,WILSON BRIDGE DRIVE,270.0
97,5295 85th Ave,270.0
941,Oxon Hill Rd at 6201 Oxon Hill Plaza,270.0
221,Annapolis Rd at Bladensburg Elem. School,269.0
1265,Valley Trail Ln at Catesby Ct,264.0
1125,Sargent Rd at Rollingcrest Commons,262.0
225,Apollo Dr at Lottsford Rd,262.0
428,Central Ave at Brightseat Rd,261.0
569,Fisher Rd at Heather Hill,260.0
1092,Riverdale Rd at Fountainbleau Dr,260.0
986,Piscataway Rd at Brandywine Rd,259.0
655,Harry S Truman Dr at Birdie Ln,258.0
1011,Queensbury Rd at 44th Pl,257.0
476,Clairfield Lane - Arrival,255.0
512,Crescent Rd at Lastner Ln,252.0
303,Bladensburg Rd at 40th Ave,251.0
614,Greenbrook Dr at Hanover Pkwy,250.0
981,Peppermill Dr at Canyon Dr,250.0
818,Manor at Victoria Park,250.0
863,Nalley Rd at Michele Ct,250.0
930,Owens Rd at Kennebec St,249.0
630,Hamilton St at 35th Ave,249.0
46,3404 Dodge Park Rd,248.0
362,Brinkley Rd at Bushey Dr,246.0
536,Donnell Dr at Marlboro Pike,245.0
826,Marlboro Pike at Melwood Mall,245.0
940,Oxon Hill Rd at 6192 Oxon Hill Rd,244.0
1281,Walker Mill Rd at Rochell Ave,242.0
952,Oxon Hill Rd at Rivertown Commons(6135),242.0
1000,Queen Chapel Rd at Queensbury Rd,241.0
764,Largo Rd at Buck Ln,240.0
47,3417 Dodge Park Rd,240.0
1034,Rhode Island Ave at 42nd Pl,239.0
1021,Raleigh Rd at Olson St,239.0
48,34th St at Bunker Hill Rd,239.0
59,38th St at Shepherd St,238.0
748,Landover Rd at 56th Ave,237.0
831,Marlboro Pike at Upland Ave,236.0
917,Old Pike Way at Dower House Rd,233.0
223,Annapolis Rd at Riverdale Rd,233.0
322,Brandywine Rd at Horshoe Rd,232.0
76,4205  Suitland Rd,232.0
1159,Southern Ave at C St,231.0
882,Old Alexandria Ferry Rd at Bellefonte Ln,229.0
514,Crescent Rd at Ridge Rd,228.0
812,Madison St at Timber Creek Dr,227.0
1204,Stuart at Surrats,227.0
271,Baltimore Ave at Knox Rd,226.0
261,Baltimore Ave at Cherry Hill Road,226.0
1010,Queensbury Rd at 44th Ave,226.0
114,7602 Riverdale Rd,224.0
297,Beltway Plaza Shopping Center,223.0
823,Marlboro Pike at Kipling Pkwy,222.0
393,CAMPUS WAY NORTH AT LADY GROVE ROAD,221.0
199,Allentown Rd at Coolridge Rd,219.0
554,Elm St at Gov Oden Bowie Dr,219.0
80,42nd At Jefferson St,218.0
430,Central Ave at Cindy Ln,218.0
670,Highview Pl at Sunbury Ct,217.0
288,Belcrest Rd at Opp. PG Plaza Station,217.0
331,Brandywine Road at Brooke Jane Drive,216.0
631,Hamilton St at 36th Ave,214.0
523,Denise Dr at Epworth Way,214.0
379,Brinkley Rd at Shopton Pl,213.0
320,Brandywine Rd at Clinton Way,212.0
215,Annapolis Rd at 48th St,211.0
578,Gallatin St at 43rd Ave,211.0
566,Fisher Rd at Clow Ct,211.0
1296,Woodyard Rd at Autumn Way,211.0
191,Ager Rd at Oglethorpe St,210.0
883,Old Alexandria Ferry Rd at Heflin Dr,210.0
868,New Carrollton Station,210.0
279,Baltimore Ave at Riverdale Rd,207.0
380,Brinkley Rd at Summerhill Rd,207.0
1052,Ritchie Rd at Alberta Dr,206.0
735,Lafayette Ave at Queensbury Rd,205.0
922,Old Silver Hill Rd at Parkland Dr,204.0
489,Columbia Park Rd at Columbia Pl,204.0
668,Highview Pl at Keyworth Ct,203.0
603,Greenbelt Rd at Greenbelt Park Entrance,202.0
20,23rd Ave at Drexel St,202.0
277,Baltimore Ave at Queensbury Rd,202.0
12,14th Ave at Langley Way,201.0
528,District Heights Pkwy at Breton Dr,201.0
17,23rd Ave at Amherst Rd,201.0
585,Goddard Space Flight Center Main Gate (Northbound),199.0
1244,Temple Hill Rd at Santeetlah Dr,198.0
493,Columbia Park Rd at Stanford Court,197.0
1080,Riverdale Rd at 54th Ave,196.0
565,Fisher Rd at Brinkley Station Dr,196.0
280,Baltimore Ave at Rossborough Ln,196.0
24,23rd Ave at Woodberry St,196.0
332,Brandywine Road at Dennison Drive,195.0
272,Baltimore Ave at Lakeland Rd,195.0
700,Indian Head Highway at Southern Ave,194.0
678,Hillside Rd at Laurel Hill Rd,194.0
1013,Queensbury Rd at Baltimore Ave,194.0
23,23rd Ave at Sheridan St,193.0
390,CAMPUS WAY AT NORTH AT ST. JOSEPHS DRIVE,193.0
217,Annapolis Rd at 53rd St,192.0
405,Campus Way South at Joyceton Dr,189.0
967,PGCC Perimeter Rd at Bickford,189.0
564,Fieldstone Way,189.0
95,5150 Annapolis Rd,189.0
641,Hampton Park Boulevard at Steeplechase,188.0
1153,Southern Ave at 13th St SE,188.0
807,MLK Jr Hwy at Sheriff Rd,188.0
473,Chillum Rd at Queens Chapel Rd,188.0
1055,Ritchie Rd at D'arcy Rd,187.0
366,Brinkley Rd at Glen Oak Dr,187.0
635,Hamilton St at 3900,187.0
791,MERCANTILE LN AT 1400 MERCANTILE LANE,187.0
1058,Ritchie Rd at Farrs Ln,186.0
742,Lamont Dr at Quentin St,186.0
729,Kipling Pkwy at Ritchie Rd,186.0
486,Columbia Park Rd at Beaver Rd,186.0
625,Gwendolyn Britt Center,186.0
612,Greenbelt Station Parkway at Streambank Lane,185.0
1261,Upshur St at 29th St,185.0
70,4106 Whitehall Square Apts,185.0
1103,Rollins Ave at Rollins Ln,185.0
432,Central Ave at Garrett A Morgan Blvd,185.0
1267,Village Dr West at Bishopmill Dr,183.0
726,Kipling Pkwy at Harwood Rd,182.0
590,Good Luck Rd at Cathedral Ave,182.0
889,Old Branch Ave at 6811 Old Branch Ave,182.0
1005,Queens Chapel Road at Queensbury Rd,181.0
1019,Rainier Ave at Upshur St,181.0
814,Mandan Rd at Canning Terr,181.0
150,ALLENTOWN ROAD & OLD BRANCH AVENUE,180.0
1176,Southern Rd at Wheeler Rd,180.0
302,Bladensburg Rd at 38th St,179.0
647,Hanover Pkwy at Hunting Ridge Club Apts,179.0
773,Largo Rd at Largo Landing,179.0
1295,Woody Terrace at Woodyard Road,178.0
696,Indian Head Highway (MD. RTE. 210) at Southern Ave,178.0
35,28th Pkwy at Fairlawn St,178.0
530,District Heights Pkwy at Marbury Ct (W),178.0
488,Columbia Park Rd at Clarkson Way,177.0
77,4211 Suitland Rd (Opposite),176.0
924,Opposite of Rose Croft Shopping Center,176.0
213,Allentown Way at Allentown Rd,175.0
937,Owens Rd at Woodland Blvd,174.0
31,28th Pkwy at 27th Ave,173.0
815,Mandan Rd at Greenbelt Rd,173.0
260,Baltimore Ave at Cherokee St,172.0
820,Marlboro Pike at Forest Run Dr,172.0
262,Baltimore Ave at East-West Hwy,172.0
464,Cheverly Ave at Montrose Rd,172.0
64,38th St at Windom Rd,171.0
1192,St Barnabas Rd at Gateway Square Apts,170.0
427,Central Ave at Bayou Ave,170.0
1008,Queensbury Rd at 41st Ave,170.0
755,Landover Rd at Firehouse Rd,170.0
1233,Temple Hill Rd at Henderson Rd,168.0
1198,St Barnabas Rd at Wheeler Rd,167.0
201,Allentown Rd at Karen Anne Dr,167.0
779,Largo Rd at West Kettering Dr,167.0
185,Ager Rd at 23rd Ave,166.0
884,Old Alexandria Ferry Rd at Highland Meadows Dr,166.0
538,Donnell Drive at Marlboro Pike,166.0
8,1400 McCormick Dr,164.0
605,Greenbelt Rd at Lakecrest Dr,164.0
1240,Temple Hill Rd at Piscataway Rd,163.0
1276,Volta Ave at Rhode Island Ave,163.0
813,Mandan Rd at 7648 Mandan Rd,163.0
1069,Ritchie Rd at Truck Way,162.0
292,Belcrest Rd at Queens Chapel Rd,162.0
300,Benning Rd at Southern Ave,162.0
1239,Temple Hill Rd at Old Temple Hill Rd,162.0
1278,Walker Mill Dr at Shady Glen Dr,162.0
708,Jericho Residences (Southbound),162.0
370,Brinkley Rd at Kildare Ct,161.0
1074,Ritchie-Marlboro Rd & Sansbury Rd,161.0
248,Auth Rd at Carswell Ave,161.0
1063,Ritchie Rd at Overton Dr,160.0
1139,Sheriff Rd at Village Green Dr,159.0
1169,Southern Ave at Premisies 800 (Park Southern Apts),159.0
229,Ardwick-Ardmore Rd at Preston St,159.0
1195,St Barnabas Rd at Lime St,158.0
210,Allentown Rd at Waldran Dr,157.0
438,Central Ave at Rollins Ave,157.0
645,Hanover Pkwy at Greenway Center Dr,157.0
960,PALMER ROAD & INDIAN HEAD HIGHWAY,157.0
615,Greenbrook Dr at Ora Glen Dr,156.0
177,Addison Rd at James Farmer Way,156.0
1062,Ritchie Rd at Napier Dr,155.0
359,Brinkley Rd at Arborview Entrance,154.0
861,Nalley Rd at Green Willow Ct,153.0
29,28th Ave at Keith St,153.0
936,Owens Rd at Wheeler Rd,153.0
632,Hamilton St at 37th Ave,152.0
7,1380 Southern Ave,152.0
787,Lottsford Rd at Harry S. Truman,152.0
717,Kanawha St at 14th Ave,152.0
491,Columbia Park Rd at Oregon Ave,150.0
348,Brightseat Rd at Evarts St,150.0
803,MLK Jr Hwy at Greig St,149.0
458,Cheverly Ave at Columbia Park Rd,149.0
662,Hastings Dr at Hill Rd,148.0
1137,Sheriff Rd at Harvey Dr,148.0
1251,Toldeo Rd at Belcrest Rd,147.0
767,Largo Rd at Eton Dr,146.0
583,Garrett A. Morgan Blvd at Rear Morgan Blvd Station,146.0
992,Pontiac St at 63rd Ave,146.0
503,County Rd at Belwood St,145.0
1121,Saint Barnabas Rd at Barrowfield Rd,145.0
1101,Rollins Ave at District Ave,144.0
878,OXON HILL FRINGE PARK AND RIDE LOT AT BUS BAY F (Arrival),144.0
634,Hamilton St at 38th St,143.0
544,East Capitol St at Old Central Ave,143.0
206,Allentown Rd at Perrie Ln,143.0
5,1301 McCormick Dr,143.0
1245,Temple Hill Rd at Spring Ter,142.0
1151,Southern Ave Station Bay E,142.0
1095,Riverdale Rd at Tanglewood Dr,142.0
195,Allentown Rd at 5711 AFCU Allentown Rd,142.0
1154,Southern Ave at 6th St SE,141.0
188,Ager Rd at Lancer Dr,141.0
127,8235 Ardwick-Ardmore Rd,140.0
124,8201 Corporate Dr,139.0
251,Auth Rd at Gloria Dr,139.0
349,Brightseat Rd at Girard St,139.0
513,Crescent Rd at Parkway,138.0
774,Largo Rd at Mount Lubentia Way,138.0
649,Hanover Pkwy at Megan Ln,138.0
972,Paint Branch Parkway at Baltimore Ave,138.0
415,Capitol Heights Blvd at Central Ave,138.0
284,Baltimore Ave at Underwood St,138.0
74,414 Brightseat Rd,137.0
866,Naylor Rd Station Bay H,137.0
852,Mike Shapiro Dr at Sheila Ln,137.0
802,MLK Jr Hwy at Glen Willow Dr,137.0
654,Hanover Pkwy at Village Park Dr,137.0
839,Maxwell Dr at Allentown Rd,137.0
113,7600 Riverdale Rd,136.0
38,3119 75th Ave (Overland Gardens),136.0
1173,Southern Ave opposite B St SE,136.0
361,Brinkley Rd at Brinkley Manor W Ent,136.0
1039,Rhode Island Ave at County Service Building - NB,135.0
886,Old Alexandria Ferry Rd at Mike Shapiro Dr,135.0
1071,Ritchie Rd at Walker Mill Rd,134.0
776,Largo Rd at Town Farm Rd,133.0
1049,Riggs Rd at University Blvd,133.0
567,Fisher Rd at Damian Dr,132.0
808,MLK Jr Hwy at Southland Dr,132.0
676,Hillside Rd at Crescent Rd,132.0
275,Baltimore Ave at Oglethorpe St,131.0
835,Matapeake Business Dr at Target Store (opposite),131.0
333,Brandywine Road at Groveton Drive,130.0
756,Landover Rd at Kent Town Place,130.0
418,Capitol Heights Blvd at Heath St,129.0
267,Baltimore Ave at Hartwick Rd,128.0
958,PALMER ROAD & DEVON HILLS DRIVE,128.0
951,Oxon Hill Rd at Riverside Plaza Apts,128.0
589,Goddard Space Flight Center Visitors Center (Southbound),128.0
643,Hanover Pkwy at Greenbelt Rd,128.0
679,Hillside Rd at Northway,128.0
911,Old Marlboro Pike at Roblee Dr,127.0
282,Baltimore Ave at Tecumseh St,125.0
107,60th Ave at Greenbelt Rd,125.0
1149,Silver Hill Rd at Swann Rd,125.0
991,Pontiac St at 60th Ave,125.0
1280,Walker Mill Rd at Brooksquare Dr,124.0
681,Hillside Rd at Woodland Way,124.0
1235,Temple Hill Rd at Lakeview Dr,124.0
67,40plgall_nb,124.0
673,Hill Rd at Willow Hill Dr,124.0
1038,Rhode Island Ave at Charles Armentrout Way,123.0
1165,Southern Ave at H St,123.0
363,Brinkley Rd at Cherryfield Rd,123.0
226,Apollo Dr at Mercantile Ln,122.0
391,CAMPUS WAY NORTH AT BYWARD BLVD,121.0
228,Ardwick-Ardmore Rd at MLK Jr Hwy,121.0
1157,Southern Ave at Barnaby Road,121.0
691,INDIAN HEAD HWY AT FORT WASHINGTON MANOR SENIOR RESIDENCES,121.0
846,McCormick Dr at UMUC,121.0
1155,Southern Ave at 9th St SE,120.0
928,Owens Rd at Irvington St,120.0
829,Marlboro Pike at Tucker's Restaurant,120.0
32,28th Pkwy at Afton St,119.0
249,Auth Rd at Clacton Ave,119.0
581,Garrett A. Morgan Blvd at Gibbs Way,119.0
1298,Woodyard Rd at Heritage Med,119.0
689,INDIAN HEAD HIGHWAY & SOUTHERN AVENUE,119.0
106,58th Ave at Berwyn Rd,119.0
1102,Rollins Ave at Hanlon Street,118.0
369,Brinkley Rd at John Hanson Ln,117.0
987,Piscataway Rd at Gwynndale Dr,117.0
550,East-West Hwy at Toledo Terr,117.0
950,Oxon Hill Rd at Oxon Hill Plaza(6201),117.0
622,Greenway Center (AM Southbound),117.0
598,Good Luck Rd at Terra Alta Dr,117.0
1166,Southern Ave at Opposite 1380 Southern Ave,116.0
664,Hastings Dr at Valley Park Rd,116.0
747,Landover Rd at 55th Ave,116.0
496,Cora B. Wood Senior Center,116.0
69,40th Pl at Gallatin St,114.0
240,Ashwood Dr at Ritchie Rd,114.0
834,Matapeake Business Dr at Target Store,113.0
925,Ora Glen Dr at Mandan Rd,113.0
862,Nalley Rd at Kaplan Ct,113.0
321,Brandywine Rd at Cork Tree Way,113.0
1051,Ritchie Rd at #2918,113.0
624,Greenway Center (PM Southbound),112.0
435,Central Ave at Norair Ave,112.0
520,Davey St at Urey Pl,112.0
1109,SOUTHERN AVENUE & CHESAPEAKE STREET SE,112.0
859,Nalley Rd at Crane Pl,112.0
431,Central Ave at Daimler Dr,111.0
364,Brinkley Rd at Farmer Dr,111.0
194,Ager Road at Roanoke St,111.0
1086,Riverdale Rd at 63rd Ave,110.0
62,38th St at Utah Ave,110.0
1177,Southway at 10 Court,110.0
750,Landover Rd at 58th Ave,108.0
382,Brinkley Rd at Trude St,108.0
961,PALMER ROAD & OLD PALMER ROAD,108.0
642,Hanover Pkwy at Green Manor Ct,107.0
984,Peppermill Dr at Pepper St,107.0
351,Brightseat Rd at Glenarden Pkwy,106.0
1163,Southern Ave at Greater SE Hospital,106.0
265,Baltimore Ave at Hamilton St,105.0
315,Bock Rd at Wolf St,105.0
81,42nd Ave and Oliver St,105.0
374,Brinkley Rd at Morton Pl,105.0
1138,Sheriff Rd at MLK Highway,104.0
751,Landover Rd at 58th Pl,104.0
607,Greenbelt Rd at Walker Dr,103.0
1232,Temple Hill Rd at Hagan Rd,103.0
1262,Upshur St at 30th St,103.0
772,Largo Rd at Kirkland Ln,102.0
268,Baltimore Ave at Hollywood Rd,102.0
661,Harvey Dr at Sheriff Rd,102.0
821,Marlboro Pike at Glacier Ave,101.0
724,Kipling Pkwy at Glendora,101.0
487,Columbia Park Rd at Cabin Branch Dr,101.0
376,Brinkley Rd at Roberts Dr,101.0
325,Brandywine Rd at Old Marbury Rd,100.0
553,Edgeworth Dr at Ritchie Rd,100.0
707,Jericho Residences,99.0
68,40th Pl at Crittenden,99.0
618,Greenhill Rd at Greenway Pl,99.0
253,Auth Rd at Magruder Ave,99.0
1131,Sheriff Rd at Dutch Village Dr - out,99.0
58,38th St at Perry St,98.0
1236,Temple Hill Rd at Lambert Dr,98.0
305,Bladensburg Rd at 41st Ave,98.0
104,5805 Queens Chapel Rd,97.0
43,3300 75th Ave,96.0
412,Capitol Heights Blvd at 734 Capitol Heights Blvd,96.0
263,Baltimore Ave at Erie St,95.0
1241,Temple Hill Rd at Plata St,95.0
616,Greenbrook Dr at Sunset Pl,95.0
506,County Rd at Valley Brook Apts,95.0
39,3133 Pennsy Dr,94.0
1023,Ray Rd at Balfour Dr,94.0
918,Old Silver Hill Rd at Addison Ave,94.0
237,Arundel Rd at 34th Ave,94.0
307,Bladensburg Rd at 43rd Ave,93.0
18,23rd Ave at Banning Pl,93.0
83,42nd Ave at Jefferson St,93.0
1234,Temple Hill Rd at Kirbywood St,92.0
1141,Sheriff Rd at William Paca School - out,92.0
527,District Heights Pkwy at Addison Rd S,92.0
460,Cheverly Ave at Forest Rd,92.0
621,Greenway Center (AM Northbound),91.0
449,Chatsfield Way at Reading Ter,91.0
330,Brandywine Road @ Surrats Road,91.0
1264,Valley Trail Ln at Bain Dr-West,91.0
505,County Rd at Foster St,90.0
1266,Valley Trail Ln at Romford Dr,90.0
36,28th Pl at Russell Ave,89.0
1037,Rhode Island Ave at Bunker Hill Rd,89.0
