,stop,boardings,alightings
902,New Carrollton Station - Arrival,573,29762
160,Addison Rd Metrorail - Arrival,977,24119
620,Gov. Oden Bowie Dr at Rear C.A.B.,1545,18743
623,Greenbelt Metro Station (Arrival),2070,18642
885,Morgan Blvd Metro Station,20805,17363
1258,Suitland Metro - Arrival,473,16998
898,Naylor Rd Station Bay H,16864,15140
418,Campus Way South at College Station Dr (PGCC),13147,12231
804,Largo Town Center Station,12358,12147
1202,Southern Ave Station Bay E - Arrival,10,10773
424,Capitol Heights - Arrival,2642,10567
317,Branch Ave Station - Arrival,10,9448
578,Equestrian Center Lot 4,11436,8968
1349,Woody Terrace at Woodyard Rd,3460,8849
1341,West Hyattsville Station,12894,7856
1200,Southern Ave Metro Rail Station at Bus Bay F,8633,7115
767,Landover Metrorail Station - Arrival,834,7021
577,Equestrian Center Lot 3,6982,6388
805,Largo Town Center Station at Bus Bay E,6665,6388
435,Capitol Heights Station Bay B,8317,5565
161,Addison Rd Metrorail Station,27441,5149
1343,West Hyattsville Station - Arrival,152,4865
478,Cheverly Station Bay D,5373,4492
1165,SOUTHERN AVENUE METRO STATION & BUS BAY K,3825,4479
714,Ikea at Bus Bay 2,2153,4188
1342,West Hyattsville Station (Arrival),74,4186
522,Courthouse,5225,4183
1264,Suitland Rd at Shadyside Ave,3010,4066
889,Mt Rainier Terminal - Arrival,94,3893
516,County Courthouse,3553,3753
642,Greenway Center,4761,3683
903,New Carrollton Station Bay F,13332,3604
491,Clinton Fringe Parking Lot,4327,3566
1028,Padgett's Corner,3797,3455
901,New Carrollton Station (Arrival),152,3413
888,Motor Vehicle Administration - Arrival,37,3264
1277,Takoma Langley Park Transit Center Bus Bay B (hidden arrival),424,3173
724,Iverson Mall,3879,3170
65,3930 Capitol Crossing Apts,5794,3134
575,Equestrian Center Lot 1 (Arrival),336,3098
930,Old Forestville Rd at Forestville Rd,2115,3076
554,Donnell Dr at Pennsylvania Ave,3413,3021
362,Brightseat Rd at Opp. Maple Ridge Apts #2,2230,2977
624,Greenbelt Metro Station Bus Bay A,19659,2964
1050,Prince George's Plaza - Arrival,801,2958
872,McCormick Dr at Basil Ct,2748,2851
361,Brightseat Rd at Opp. Maple Ridge Apts #1,325,2845
740,Judge's Dr at Pratt St,428,2760
925,Old Branch Ave at Coventry Way,2989,2741
202,Allentown Rd at Temple Hill Rd,2593,2716
490,Clinton Fringe Lot,7741,2689
493,College Park Metro Station at Bus Bay B,2766,2619
464,Cherrywood Ln at Greenbelt Rd (MD. RTE. 193),3442,2558
1355,Woodyard Rd at Pine View Ln,180,2496
1255,Stuart Ln at Woodyard Rd,405,2389
1065,RUBY LOCKHART BLVD AT CAMPUS WAY NORTH,1795,2388
477,Cheverly Metrorail Station Bay D,2633,2373
549,Doctors Community Hospital,2530,2360
555,Donnell Drive at Marlboro Pike,384,2352
650,Hamilton St at 31st Ave,4433,2291
1105,Ritchie Rd at Forest Park Dr,2491,2270
358,Brightseat Rd at Maple Ridge Apts #2,5293,2248
761,Lamont Dr at Powhatan St,1907,2240
955,Old Silver Hill Rd at Library,2027,2127
922,Old Branch Ave at Allentown Way,2668,2115
937,Old Marlboro Pike at John Rogers Blvd,2562,2111
566,East-West Hwy at Prince George's Mall Ent.,258,2085
174,Addison Rd at Walker Mill Rd,2500,2077
291,Belcrest Rd at PG Plaza Entrance,251,2071
1025,PGCC Perimeter Rd at Largo Rd,2546,2063
1276,Takoma Langley Park Transit Center Bus Bay B,5813,2045
1003,Oxon Hill Rd at Oxon Hill Fringe Parking Lot,0,2036
608,Goddard Space Flight Center Main Gate (Southbound),170,2025
190,Allentown Rd at Brinkley Rd,2477,1996
1248,St Clair Dr at 28th Ave,1530,1986
215,Annapolis Rd at 85th Ave,230,1982
76,4192 Whitehall Square Apts,169,1971
837,MONUMENT AVE @ MGM CASINO,537,1942
1118,Ritchie Station Court Bus Stop #1,557,1937
1020,PG Plaza Station,2124,1895
1267,Suitland Rd at Towne Square Blvd,1839,1889
866,Mattawoman Beantown Rd at Pinefield Center,1610,1831
1235,Springhill Ln at Breezewood Dr,1360,1823
879,Mercantile Ln at Technology Way,1962,1815
387,Brinkley Rd at Rosecroft Shopping Center,325,1808
1249,St George Blvd at Waterfront St,1481,1799
78,4258 Whitehall Square Apts,2875,1784
519,County Rd at Foster St,781,1734
1210,Southern Ave at Chesapeake St SE,2918,1673
1136,Riverdale Rd at Carrollton Mall,1774,1667
277,Baltimore Ave at Queensbury Rd,1768,1617
763,Lamont Dr at Westbrook Dr,956,1614
243,Auburn Ave at Riverdale Rd,1143,1553
375,Brinkley Rd at Huntley Square Dr,771,1540
217,Annapolis Rd at Edmonston Rd,1624,1540
1196,Silver Hill Rd at Pennsylvania Ave,1613,1536
1284,Temple Hill Rd at Farmer Dr,1313,1534
1356,Woodyard Rd at Pineview Ln,1380,1529
865,Matapeake Business Dr at Target Store (Hidden Arrival),7,1498
725,Iverson St at 28th Ave,861,1491
1039,Piscataway Rd at Absher Ln,1700,1488
626,Greenbelt Rd at Greenway Center,1161,1475
397,Brooks Dr at Pennsylvania Ave,2089,1431
844,Mandan Rd at Hanover Pkwy,15,1429
1037,Peppermill Dr at Hastings Dr,80,1415
298,Beltway Plaza Shopping Center,813,1405
658,Hampton Park Boulevard at Alaking Ct,1080,1386
928,Old Branch Ave at PGCC Skilled Trade Center,1131,1371
1019,PG Plaza,1214,1361
986,Oxon Hill Fringe Parking Lot Bus Bay B,815,1359
256,Baltimore Ave at Berwyn House Rd,1454,1358
1023,PG Sports Complex Front Ent.,1400,1353
1340,Walker Mill Road at Marlboro Pike,835,1351
602,Garrett A. Morgan Blvd at Morgan Blvd Station,887,1345
651,Hamilton St at 31st Ave - in,250,1343
342,Brightseat Rd at Ardwick-Ardmore Rd,1004,1335
604,Garrett A. Morgan Blvd at Rear Morgan Blvd Station Walkway,259,1331
171,Addison Rd at Ronald Rd,1988,1325
887,Motor Vehicle Administration,4284,1320
884,Mike Shapiro Dr at Sheila Ln,1403,1313
1305,Timothy Branch Dr at Safeway Ent,790,1301
1250,Stars Entrance Gaylord Hotel at National Harbor Blvd,525,1294
558,Dunmore Pl at Edgeworth Dr,608,1293
337,Breezewood Dr at Cherrywood Ln,644,1290
72,4112 Whitehall Square Apts,455,1287
1221,Southern Ave at Wheeler Rd,884,1282
1348,Wmap Rd at Icesat Rd,1019,1278
1260,Suitland Rd at 4410 Suitland Rd,574,1277
847,Marlboro Pike at County Rd,2469,1269
1071,Raleigh Rd at St Barnabas Rd,929,1262
606,Goddard Space Flight Center Main Gate (Northbound),422,1255
75,4174 Whitehall Square Apts,1002,1238
1263,Suitland Rd at Opposite Prem. #4211,0,1235
15,15th Ave at University Blvd,607,1233
667,Hanover Pkwy at Hanover Dr,1337,1232
319,Branchwood Towers,1092,1217
401,CAB - Arrival,13,1214
1224,Southern Maryland Hospital (Hidden Arrival),38,1210
506,Columbia Park Rd at South Club Dr,662,1210
538,Denise Dr at Epworth Way,774,1204
781,Lansdowne Village Apts,1258,1199
24,23rd Ave at Lewisdale Dr,946,1196
366,Brinkley Rd at Brinkley House W Ent,212,1187
1233,Springhill Dr at Springhill Ln,998,1186
1032,Pennsylvania Ave at Old Marlboro Pl,77,1180
122,85th Avenue and Carrollon Manor,460,1172
1234,Springhill Ln at Breezewood Ct,1386,1162
417,Campus Way South at Central Ave,821,1148
1127,Riverdale Rd at 57th Ave,1902,1134
526,Crescent Rd at Gardenway,1381,1132
1302,Temple Hill Rd at St Barnabas Rd,1545,1128
423,Campus Way at PGCC Perimeter Rd,797,1124
1314,University Blvd at Riggs Rd,2415,1090
83,42nd Ave at Madison St,435,1086
16,16th Ave at Cypress Creek Dr,795,1076
1176,Sheriff Rd at Belle Haven Dr,277,1071
565,East-West Hwy at Metro Center Dr,651,1066
399,Brooks Drive at Marlboro Pike,838,1058
1237,Springhill Ln at Springhill Dr,1061,1045
42,3209 75th Ave,1654,1033
260,Baltimore Ave at Cherry Hill Road,697,1028
860,Marlboro Pike at Walters Ln,937,1024
661,Hampton Park Boulevard at Hampton Mall Dr,823,1013
1078,Rhode Island Ave at 34th Street,598,1003
628,Greenbelt Rd at Opp. Greenbelt Center,1162,1001
302,Bladensburg Rd at 38th St,1097,999
338,Breezewood Dr at Cherrywood Ter,1144,988
162,Addison Rd at Adak St,805,985
957,Old Silver Hill Rd at Parkland Dr,1051,985
73,4138 Whitehall Square Apts - in,788,983
556,Donnell Drive at Target Store,478,971
189,Allentown Rd at Allentown Way,251,967
488,Cipriano Rd at Brae Brooke Dr,1354,945
31,28th Ave at Keith St,1047,936
612,Good Luck Rd at Crest Park Dr,103,933
216,Annapolis Rd at Bladensburg Elem. School,313,917
1069,Raleigh Rd at Culver St,1076,914
720,Indian Head Highway at Audrey Ln,578,913
484,Chillum Rd at Longford Dr,1237,913
751,Kipling Pkwy at Marlboro Pike,956,906
85,42nd Ave at Oglethorpe St,1177,905
666,Hanover Pkwy at Greenway Center Dr,1195,903
987,Oxon Hill Fringe Parking Lot at Bus Bay F,143,901
53,38th St at Bunker Hill Rd,595,892
492,Clinton Manor,1069,883
580,Fairlawn St at Colebrooke Dr,404,881
294,Belcrest at PG Plaza Metrorail,1088,880
920,Old Alexandria Ferry Rd at Woodyard Rd,838,869
829,MLK Jr Hwy at Columbia Park Rd,736,866
430,Capitol Heights Blvd at Emmet St,441,862
1297,Temple Hill Rd at Portal Ave,634,860
567,East-West Hwy at Toledo Ter,455,856
550,Dodge Park Rd at Hubbard Rd,1451,856
672,Hanover Pkwy at Ora Glen Dr,396,845
659,Hampton Park Boulevard at East Hampton Dr,249,841
677,Harry S Truman Dr at Birdie Ln,971,839
1024,PGCC Perimeter Rd at Annex A Building,365,838
442,Central Ave at Brightseat Rd,787,835
1049,Possum Ct at Walker Mill Dr,893,823
1280,Temple Hill Rd at Allentown Rd,779,818
197,Allentown Rd at Old Branch Ave,388,816
1336,Walker Mill Rd at Rochell Ave,1037,809
1100,Ritchie Rd at Central Ave,79,803
259,Baltimore Ave at Cherokee St,945,800
1232,Springhill Dr at Cherrywood Ln,1042,799
420,Campus Way South at Joyceton Dr,1644,797
502,Columbia Park Rd at Marshall Pl,737,791
1033,Pennsylvania Ave at Penn Crossing Dr,443,787
990,Oxon Hill Rd at 6192 Oxon Hill Rd,412,775
756,Lamont Dr at Carrollton Pkwy,1544,771
1031,Pennsylvania Ave at Forestville Rd,301,771
1137,Riverdale Rd at Eastpine Dr,94,769
1073,Ray Rd at Cypress Creek Dr,566,765
282,Baltimore Ave at Tecumseh St,387,765
953,Old Pike Way at Dower House Rd,828,762
1113,Ritchie Rd at Roslyn Ave,523,761
1319,Valley Trail Ln at Catesby Ct,1071,760
1308,Toledo Rd at Belcrest Rd,638,755
613,Good Luck Rd at Dawnwood Dr,639,754
818,Lottsford Rd at Zachery St,579,750
192,Allentown Rd at Camp Springs Ave,1446,745
279,Baltimore Ave at Riverdale Rd,121,739
869,Maxwell Dr at Allentown Rd,744,738
790,Largo Rd at Hancock Dr,64,733
267,Baltimore Ave at Hartwick Rd,970,732
1307,Toledo Rd at Adelphi Rd,645,723
801,Largo Rd at Watkins Park Dr,188,723
859,Marlboro Pike at Upland Ave,830,719
743,Kenilworth Ave at Nicholson St,343,717
1134,Riverdale Rd at 67th Ave,927,716
958,Olson St at Norcross St,314,714
1054,Queens Chapel Rd at Hamilton St,420,712
98,54th Ave at Jefferson St,511,712
652,Hamilton St at 35th Ave,1020,712
783,Largo Rd  at Water Foul Way,11,710
272,Baltimore Ave at Lakeland Rd,576,710
300,Benning Rd at Drum Ave,395,709
774,Landover Rd at Annapolis Rd,697,706
1332,Walker Mill Dr at New Mt. Nebo Baptist Church,409,705
1051,Prince George's Plaza Entrance,0,702
1120,Ritchie-Marlboro Rd & Sansbury Rd,635,702
501,Columbia Park Rd at Columbia Pl,733,700
520,County Rd at Valley Brook Apts,709,699
486,Chillum Rd at Shoppers Food,206,698
288,Belcrest Rd at 6505 Belcrest Rd,1375,695
1209,Southern Ave at C St,445,692
895,Nalley Rd at Michele Ct,229,692
398,Brooks Dr at Ridley St,1283,692
718,Indian Head Highway (MD. RTE. 210) at Southern Ave,732,685
591,Fisher Rd at St. Moritz Dr,923,678
1298,Temple Hill Rd at Rickey Ave,891,678
665,Hanover Pkwy at Greenbrook Dr,904,675
673,Hanover Pkwy at Prem # 7718,1181,675
622,Greenbelt Metro Dr at Cherrywood Ln,505,674
1140,Riverdale Rd at Heritage Square Apts,206,673
593,Forestville Rd at Parston Dr,1037,672
242,Auburn Ave at Chestnut Ave,315,669
851,Marlboro Pike at Kipling Pkwy,536,664
1205,Southern Ave at 9th St SE,974,655
102,5827 Allentown Way at Old Branch Ave,201,654
1075,Ray Rd at Madison St,552,654
1098,Ritchie Rd at Alberta Dr,271,650
411,Campus Way North at Grey Gables Ct,787,647
757,Lamont Dr at Donoghue Dr,655,647
523,Coventry Way at Old Alexandria Ferry Rd,403,643
978,Owens Rd at Kennebec St,650,641
846,Manor at Victoria Park,686,638
1040,Piscataway Rd at Brandywine Rd,96,637
84,42nd Ave at Nicholson St,1159,629
1044,Piscataway Rd at Pella Place,774,628
754,Kipling Pkwy at Wintergreen Ave,752,626
30,28th Ave at Keating St,666,626
521,County Service Building,907,623
1218,Southern Ave at Robert Yedell Towers,415,622
572,Elm St at Gov Oden Bowie Dr,1611,621
219,Apollo Dr at Arena Dr,478,618
660,Hampton Park Boulevard at Edgeworth Dr,254,617
706,Hubbard Rd at Martin Luther King,598,617
1008,Oxon Hill Rd at Rivertown Commons(6135),708,615
494,College Park Station,468,611
333,Brandywine Road at Brooke Jane Drive,89,610
926,Old Branch Ave at Kirby Ln,56,609
662,Hampton Park Boulevard at Steeplechase,414,605
1116,Ritchie Rd at Vineyard Dr,738,605
392,Brinkley Rd at Temple Hill Rd,494,603
1229,Southway at Crescent Rd,513,602
886,Morris Ave at Maxwell Dr,434,600
1331,WILSON BRIDGE DRIVE,646,598
48,34th St at Bunker Hill Rd,207,593
1174,Sargent Rd at Rollingcrest Commons,649,591
236,Ashwood Dr at Dunmore Pl,434,589
992,Oxon Hill Rd at 6246 Oxon Hill Rd,411,588
551,Dodge Park Rd at Landover Rd,603,587
59,38th St at Shepherd St,388,585
991,Oxon Hill Rd at 6201 Oxon Hill Plaza,286,582
749,Kipling Pkwy at Harwood Rd,628,581
99,5600 54th Ave,406,579
759,Lamont Dr at Lamont Pl,837,579
1197,Silver Hill Rd at Randall Rd,600,579
220,Apollo Dr at Lottsford Rd,576,571
290,Belcrest Rd at PG Plaza,354,569
1055,Queens Chapel Rd at Lancer Dr,290,566
854,Marlboro Pike at Melwood Mall,689,566
722,Indian Head Highway at Southern Ave,458,564
1198,Silver Hill Rd at Suitland Rd,685,560
74,414 Brightseat Rd,368,558
548,District Heights Pkwy at Rochelle Ave,707,556
543,District Heights Pkwy at Addison Rd S,661,556
1070,Raleigh Rd at Olson St,753,550
768,Landover Rd at 55th Ave,896,550
434,Capitol Heights Station,6193,548
271,Baltimore Ave at Knox Rd,372,546
1194,Silver Hill Rd at Parkway Terrace Dr,734,545
275,Baltimore Ave at Oglethorpe St,368,545
1110,Ritchie Rd at Ritchie Dr,391,542
870,Maxwell Dr at Morris Ave,693,537
479,Chillum Rd at 18th Ave,82,535
293,Belcrest Rd at Queens Chapel Rd,683,535
1351,Woodyard Rd at Autumn Way,166,534
760,Lamont Dr at Larchwood St,192,533
553,Donnell Dr at Marlboro Pike,1910,533
562,East Capitol St at Yost Pl,497,529
280,Baltimore Ave at Rossborough Ln,382,529
1245,St Barnabas Rd at Raleigh Rd,498,527
476,Cheverly Ave at Montrose Rd,393,525
1014,PALMER ROAD & DEVON HILLS DRIVE,658,524
989,Oxon Hill Rd at 6130 Oxon Hill Rd,190,522
218,Annapolis Rd at Riverdale Rd,1013,522
9,1400 Merchantile Ln,221,522
1187,Sheriff Rd at MLK Highway,201,519
601,Garrett A. Morgan Blvd at Gibbs Way,171,516
315,Bock Rd at Technology Recreation Complex,302,513
25,23rd Ave at Sheridan St,506,511
1299,Temple Hill Rd at Santeetlah Dr,190,508
1261,Suitland Rd at Homer Ave,363,508
389,Brinkley Rd at Shopton Pl,376,508
1315,Upshur St at 28th St,274,505
946,Old Marlboro Pike at Roblee Dr,552,505
904,New Carrollton Station Bay K,3547,505
868,Mattowoman Beantown Rd at MTA Park and Ride Lot (Arrival),30,500
890,Nalley Rd at Capital View Dr,853,499
64,38th St at Windom Rd,900,498
636,Greenbrook Dr at Hanover Pkwy,470,496
1265,Suitland Rd at Suitland Federal Center Gate 1,696,496
1304,Temple Hill Rd at Weldon Dr,702,494
444,Central Ave at Cindy Ln,979,494
589,Fisher Rd at Heather Hill Ent.,234,494
336,Brandywine Road at Surrats Road,260,492
126,9240 Springhill Ln,194,491
840,Madison St at Timber Creek Dr,749,489
1186,Sheriff Rd at Harvey Dr,357,489
924,Old Branch Ave at Arbutus Ln,612,489
47,3417 Dodge Park Rd,490,488
49,34th St at Newton St,50,487
409,Campus Drive at Baltimore Ave,160,485
1287,Temple Hill Rd at Henderson Rd,384,485
184,Ager Rd at Oglethorpe St,588,484
1021,PG Plaza Station (Hidden Arrival),0,483
41,3133 Pennsy Dr,494,483
653,Hamilton St at 36th Ave,833,482
1141,Riverdale Rd at Mahoney Dr,601,481
4,10800 Indian Head Highway at Fort Washington Manor,363,481
26,23rd Ave at Woodberry St,331,480
386,Brinkley Rd at Rose Croft Shopping Center,355,479
19,23rd Ave at Amherst Rd,1224,479
585,Fisher Rd at Clow Ct,670,478
405,CAMPUS WAY NORTH AT LADY GROVE ROAD,386,478
507,Columbia Park Rd at Stanford Court,127,476
1321,Village Dr West at Bishopmill Dr,475,475
655,Hamilton St at 38th Ave,372,472
20,23rd Ave at Banning Pl,851,470
262,Baltimore Ave at East-West Hwy,863,467
123,85th Avenue and Hiltop Apartments,291,465
105,60th Ave at Greenbelt Rd,368,463
1203,Southern Ave at 13th St SE,896,461
27,2400 Chillum Rd,489,461
821,MLK Jr Hwy at 65th Ave,509,461
391,Brinkley Rd at Summerhill Rd,567,459
1106,Ritchie Rd at Mane Ln,286,458
500,Columbia Park Rd at Clarkson Way,177,458
1035,Peppermill Dr at Canyon Dr,731,457
537,Denise Dr at Dutton Way,1123,455
489,Clairfield Lane - Arrival,9,455
900,New Carrollton Station,20468,455
1111,Ritchie Rd at Ritchie Rd Spur,786,454
1138,Riverdale Rd at Fernwood Terrance,91,449
701,Hillside Rd at Laurel Hill Rd,396,446
611,Good Luck Rd at Cathedral Ave,472,446
848,Marlboro Pike at Forest Run Dr,59,444
77,4211 Suitland Rd (Opposite),74,442
402,CAMPUS WAY AT NORTH AT ST. JOSEPHS DRIVE,416,439
238,Ashwood Dr at Ritchie Rd,72,439
322,Brandywine Rd at Clinton Way,182,439
529,Crescent Rd at Ridge Rd,209,438
33,28th Pkwy at 27th Ave,473,436
1262,Suitland Rd at Opp. Suitland Federal Center Gate 3,366,435
988,Oxon Hill Rd OXON HILL FRINGE at Oxon Rd (arrival) (Arrival),11,432
830,MLK Jr Hwy at Glen Willow Dr,750,430
432,Capitol Heights Blvd at Heath St,241,428
1099,Ritchie Rd at Ashville Rd,519,427
1181,Sheriff Rd at Dutch Village Dr,305,425
55,38th St at Hamilton St,517,425
446,Central Ave at Garrett A Morgan Blvd,103,419
795,Largo Rd at Largo Landing,499,418
421,Campus Way South at PGCC Perimeter Rd,346,414
22,23rd Ave at Drexel St,649,410
1101,Ritchie Rd at D'arcy Rd,339,409
742,Kanawha St at 15th Ave,865,409
210,Annapolis Rd at 48th St,309,406
1017,PALMER ROAD & OLD PALMER ROAD,587,406
1223,Southern Maryland Hospital,1643,403
157,ALLENTOWN WAY & 5846 ALLENTOWN WAY,0,401
544,District Heights Pkwy at Breton Dr,532,400
369,Brinkley Rd at Cherryfield Rd,151,399
1139,Riverdale Rd at Fountainbleau Dr,1136,398
1328,Village Green Dr at Sheriff Rd,408,396
193,Allentown Rd at Coolridge Rd,489,394
505,Columbia Park Rd at Oregon Ave,99,394
90,4412 Suitland Rd (Opposite),349,388
334,Brandywine Road at Dennison Drive,80,386
1088,Rhode Island Ave at County Service Building - SB,323,385
195,Allentown Rd at Karen Anne Dr,399,383
34,28th Pkwy at Afton St,434,382
125,9206 Springhill Lane,1403,380
656,Hamilton St at 38th St,381,379
676,Hanover Pkwy at Village Park Dr,381,379
766,Landover Metrorail Station,5848,379
769,Landover Rd at 56th Ave,290,375
320,Brandywine Rd & Gwynn Park High School,666,374
1016,PALMER ROAD & INDIAN HEAD HIGHWAY,607,374
188,Allentown Rd at 5711 AFCU Allentown Rd,294,373
842,Mandan Rd at Canning Terr,405,372
1317,Valley Trail Ln at Bain Dr 1,613,372
627,Greenbelt Rd at Lakecrest Dr,305,371
268,Baltimore Ave at Hollywood Rd,385,369
1083,Rhode Island Ave at 42nd Pl,328,368
621,Governor Oden Bowie Dr at Elm St,137,367
58,38th St at Perry St,254,367
816,Lottsford Rd at McCormick Dr,75,367
13,14th Ave at Langley Way,338,366
1193,Silver Hill Rd at Metro Dr,82,365
1295,Temple Hill Rd at Piscataway Rd,279,364
730,Jericho Residences,248,362
1320,Valley Trail Ln at Romford Dr,472,359
691,Highview Pl at Onslow Way,459,359
1214,Southern Ave at H St,142,359
372,Brinkley Rd at Glen Oak Dr,175,358
731,Jericho Residences (Southbound),410,357
849,Marlboro Pike at Glacier Ave,227,357
634,Greenbelt Station Parkway at Streambank Lane,126,357
746,Kipling Pkwy at Brewton St,354,357
1087,Rhode Island Ave at County Service Building - NB,421,356
1170,Saint Barnabas Rd at Barrowfield Rd,223,355
324,Brandywine Rd at Horshoe Rd,60,355
1080,Rhode Island Ave at 38th St,431,354
393,Brinkley Rd at Trude St,264,354
1133,Riverdale Rd at 64th Ave,754,352
963,Opp. 1300 McCormick Dr,131,352
893,Nalley Rd at Green Willow Ct,407,351
1204,Southern Ave at 6th St SE,237,351
1151,Rollins Ave at Rollins Ln,386,350
877,McCormick Dr at UMUC,347,350
7,1301 McCormick Dr,470,350
363,Brightseat Rd at Social Services Bldg.,652,349
921,Old Branch Ave at 6811 Old Branch Ave,93,348
786,Largo Rd at Buck Ln,234,348
104,58th Ave at Berwyn Rd,261,347
377,Brinkley Rd at Kildare Ct,111,347
517,County Rd at Belwood St,254,346
1056,Queens Chapel Rd at Nicholson St,255,346
384,Brinkley Rd at Opp. Rosecroft Shopping Center,1312,345
46,3404 Dodge Park Rd,414,344
127,9400 Peppercorn Pl,275,344
1199,Silver Hill Rd at Swann Rd,195,343
205,Allentown Rd at Westchester Ct,393,342
1124,Riverdale Rd and 7600 Riverdale Road,380,341
813,Lottsford Rd at Harry S. Truman,192,339
629,Greenbelt Rd at Walker Dr,326,337
1244,St Barnabas Rd at Opp. Gateway Square Apts,132,337
690,Highview Pl at Keyworth Ct,527,336
959,Opp 3133 Pennsy Dr,343,336
1007,Oxon Hill Rd at Riverside Plaza Apts,1048,334
1301,Temple Hill Rd at Spring Ter,376,333
835,MLK Jr Hwy at Sheriff Rd,338,332
1108,Ritchie Rd at Overton Dr,198,330
984,Owens Rd at Woodland Blvd,276,329
976,Owens Rd at Irvington St,200,328
1117,Ritchie Rd at Walker Mill Rd,163,325
1318,Valley Trail Ln at Bain Dr 2,416,324
983,Owens Rd at Wheeler Rd,219,324
1045,Pontiac St at 60th Ave,294,321
71,4106 Whitehall Square Apts,1175,320
381,Brinkley Rd at Middlefield Rd,90,319
1201,Southern Ave Station Bay E,10582,319
750,Kipling Pkwy at Marbury Dr,471,318
1211,Southern Ave at Forest Hills Apartment,408,315
916,Old Alexandria Ferry Rd at Malcom Rd,122,315
648,Gwynn Park High School,355,314
546,District Heights Pkwy at Marbury Ct (W),484,314
1126,Riverdale Rd at 54th Ave,497,313
590,Fisher Rd at Holton Ln,156,312
1107,Ritchie Rd at Napier Dr,378,311
103,5846 ALLENTOWN WAY,119,310
1330,Volta Ave at Rhode Island Ave,266,309
351,Brightseat Rd at Girard St,247,309
1236,Springhill Ln at Market Ln,666,309
170,Addison Rd at James Farmer Way,215,308
762,Lamont Dr at Quentin St,402,305
452,Central Ave at Rollins Ave,91,303
843,Mandan Rd at Greenbelt Rd,470,303
374,Brinkley Rd at Huncrest Ent,455,302
224,Ardwick-Ardmore Rd at MLK Jr Hwy,193,302
483,Chillum Rd at Buchanan St,447,302
1091,Rhode Island Ave at Volta Ave,331,302
1191,Sheriff Rd at William Paca School,164,301
463,Cherrywood Ln at Greenbelt Federal Courthouse,263,301
1288,Temple Hill Rd at Kirbywood St,430,300
776,Landover Rd at Firehouse Rd,122,299
542,District Heights Municipal Bldg,275,299
752,Kipling Pkwy at Opp. 7805 Ritchie Rd,408,298
1005,Oxon Hill Rd at Oxon Hill Plaza(6201),425,298
561,East Capitol St at Old Central Ave,140,297
1115,Ritchie Rd at Truck Way,737,297
857,Marlboro Pike at Tucker's Restaurant,303,297
875,McCormick Dr at Opp. UMUC Building,202,297
445,Central Ave at Daimler Dr,373,296
891,Nalley Rd at Crane Pl,459,295
973,Ora Glen Dr at Mandan Rd,202,295
917,Old Alexandria Ferry Rd at Mike Shapiro Dr,282,294
1038,Peppermill Dr at Pepper St,266,294
485,Chillum Rd at Queens Chapel Rd,894,294
110,7600 Riverdale Rd,723,292
111,7711 Old Alexandria Ferry Rd,26,292
972,Opposite of Rose Croft Shopping Center,565,292
1246,St Barnabas Rd at Temple Hill Rd,28,291
518,County Rd at Elmhurst St,208,290
711,INDIAN HEAD HIGHWAY & SOUTHERN AVENUE,196,290
200,Allentown Rd at Perrie Ln,278,290
913,Old Alexandria Ferry Rd at Heflin Dr,320,290
571,Edgeworth Dr at Ritchie Rd,162,289
1192,Sheriff Rd at Willowood Ct,203,288
645,Greenway Center (PM Northbound),210,287
1316,Upshur St at 30th St,188,286
1143,Riverdale Rd at Tanglewood Dr,362,284
352,Brightseat Rd at Glen Valley Dr,461,284
1352,Woodyard Rd at Canberra Dr,545,283
797,Largo Rd at Opp. Town Farm Rd,44,283
207,Allentown Way at Allentown Rd,116,282
1053,Queen Chapel Rd at Queensbury Rd,10,282
772,Landover Rd at 58th Pl,77,281
37,28th Pkwy at Fairlawn St,106,281
864,Matapeake Business Dr at Target Store,2000,280
1079,Rhode Island Ave at 37th St,485,280
794,Largo Rd at Kirkland Ln,3,280
449,Central Ave at Norair Ave,158,279
349,Brightseat Rd at Continental Pl,134,278
1150,Rollins Ave at Hanlon Street,242,277
221,Apollo Dr at Mercantile Ln,208,273
316,Bock Rd at Wolf St,700,272
1227,Southway at 11 Court,87,272
38,28th Pl at Russell Ave,286,271
1132,Riverdale Rd at 63rd Ave,91,270
263,Baltimore Ave at Erie St,214,270
1335,Walker Mill Rd at Brooksquare Dr,142,268
1112,Ritchie Rd at Ritchie-Marlboro Rd,227,268
739,John Rogers Blvd at Old Marlboro Pike,100,268
802,Largo Rd at West Kettering Dr,11,267
1252,Stuart Ln at Surrats Rd,32,267
841,Mandan Rd at 7648 Mandan Rd,158,267
914,Old Alexandria Ferry Rd at Highland Meadows Dr,62,266
528,Crescent Rd at Parkway,66,265
1292,Temple Hill Rd at Old Temple Hill Rd,487,264
286,Baltimore Ave at Van Buren St,196,264
1334,Walker Mill Drive at Shady Glen Drive,373,264
956,Old Silver Hill Rd at Parkland Ct (E),182,263
212,Annapolis Rd at 53rd St,161,263
459,Centre Pointe Office Park,154,263
376,Brinkley Rd at John Hanson Ln,76,262
657,Hamilton St at 3900,590,262
1291,Temple Hill Rd at Megan Dr,348,262
1306,Toldeo Rd at Belcrest Rd,67,260
305,Bladensburg Rd at 41st Ave,414,260
670,Hanover Pkwy at Megan Ln,241,259
1311,University Blvd at 23rd Ave,1038,259
625,Greenbelt Rd at Greenbelt Park Entrance,174,259
592,Fisher Rd at Temple Blvd,352,258
1077,Rhode Island Ave at 34th St,535,258
940,Old Marlboro Pike at Melwood Park Ave,297,258
1247,St Barnabas Rd at Wheeler Rd,125,258
539,Denise Dr at Rollins Ave,460,255
607,Goddard Space Flight Center Main Gate (PM Southbound),304,255
996,Oxon Hill Rd at Harborview Rd,301,254
883,Metro Dr at Gate 7 Security Booth,239,254
777,Landover Rd at Kent Town Place,77,254
1225,Southern Rd at Wheeler Rd,371,253
598,Gallatin St at 43rd Ave,117,253
716,Indian Head Highway (MD RTE. 210) at Livingston Rd,129,251
892,Nalley Rd at East Nalley Rd,325,250
663,Hanover Pkwy at Green Manor Ct,426,249
461,Chatsfield Way at Reading Ter,373,248
196,Allentown Rd at Kingston Dr,184,247
637,Greenbrook Dr at Ora Glen Dr,311,246
204,Allentown Rd at Waldran Dr,314,245
688,Highview Pl at Brooke Rd,388,245
94,5150 Annapolis Rd,461,245
332,Brandywine Road @ Surrats Road,439,244
194,Allentown Rd at Dodge Ln,271,244
647,Gwendolyn Britt Center,259,244
696,Hill Rd at Willow Hill Dr,201,243
8,1400 McCormick Dr,63,243
235,Arundel Rd at 34th Ave,71,243
941,Old Marlboro Pike at Melwood Rd,305,243
214,Annapolis Rd at 54th St,110,242
