,stop,boardings,alightings
168,Addison Rd Metrorail Station,20211,5264
869,New Carrollton Station,17652,276
602,Greenbelt Metro Station Bus Bay A,17254,7548
867,Naylor Rd Station Bay H,15365,191
1209,Suitland Metrorail Station Bay D,14046,249
854,Morgan Blvd Metro Station,12969,10643
1287,West Hyattsville Station,11550,6987
317,Branch Ave Station Bus Bay J,11071,120
508,Courthouse,10564,2867
421,Capitol Heights Station Bay B,9741,8716
781,Largo Town Center Station,9704,8631
403,Campus Way South at College Station Dr (PGCC),8742,8311
872,New Carrollton Station Bay F,8640,6179
1152,Southern Ave Station Bay E,8419,177
477,Clinton Fringe Lot,8354,4905
782,Largo Town Center Station at Bus Bay E,5992,5986
1151,Southern Ave Metro Rail Station at Bus Bay F,5708,4569
559,Equestrian Center Lot 4,5141,3581
745,Landover Metrorail Station,5074,1022
1223,Takoma Langley Park Transit Center Bus Bay B,4854,967
466,Cheverly Station Bay D,4749,4610
409,Capitol Crossing Apts,4710,2677
420,Capitol Heights Station,4582,618
478,Clinton Fringe Parking Lot,4571,3932
744,Landover Mall,4249,3886
620,Greenway Center,4045,2403
701,Iverson Mall,4008,3925
501,County Administration Building,3993,9587
892,Old Branch Ave at Allentown Way,3934,3039
1302,Woodyard Rd at Pine View Ln,3862,2665
558,Equestrian Center Lot 3,3296,3205
208,Allentown Rd at Temple Hill Rd,3213,2302
480,College Park Metro Station at Bus Bay B,3156,3116
837,Mattawoman Beantown Rd at Pinefield Center,3126,3616
628,Hamilton St at 31st Ave,3126,1987
79,4258 Whitehall Square Apts,3012,853
1029,Rhode Island (US RTE 1) at Mount Rainer Terminal,2909,14
502,County Courthouse,2883,3469
1214,Suitland Rd at Shadyside Ave,2754,3818
86,42nd Ave at Oglethorpe St,2509,1459
1295,Woody Terrace at Woodyard Rd,2454,7689
895,Old Branch Ave at Coventry Way,2388,2782
965,PG Plaza Station,2363,1663
288,Belcrest Rd at Opp. PG Plaza Station,2298,439
1119,SOUTHERN AVENUE METRO STATION & BUS BAY K,2285,2423
652,Hanover Pkwy at Prem # 7800,2265,0
601,Greenbelt Metro Station (Arrival),2251,12347
856,Motor Vehicle Administration,2191,775
1082,Riverdale Rd at 57th Ave,2169,1418
972,PGCC Perimeter Rd at Largo Rd,2159,1560
843,McCormick Dr at Basil Ct,2142,2550
537,Donnell Dr at Pennsylvania Ave,2139,1746
452,Cherrywood Ln at Greenbelt Rd (MD. RTE. 193),2093,1166
573,Forestville Rd at Parston Dr,2089,1269
290,Belcrest Rd at PG Plaza Metrorail,2051,3743
197,Allentown Rd at Brinkley Rd,2042,1810
465,Cheverly Metrorail Station Bay D,2025,1779
873,New Carrollton Station Bay K,2023,559
850,Mercantile Ln at Technology Way,2011,1877
1060,Ritchie Rd at Forest Park Dr,1998,1829
973,Padgett's Corner,1991,2402
532,Doctors Community Hospital,1966,1775
987,Piscataway Rd at Absher Ln,1964,1363
819,Marlboro Pike at County Rd,1933,929
386,Brooks Dr at Pennsylvania Ave,1917,1202
595,Good Luck Rd at Parkdale HS,1899,167
481,College Park Station,1830,1936
964,PG Plaza,1826,1517
1161,Southern Ave at Chesapeake St SE,1768,842
904,Old Marlboro Pike at John Rogers Blvd,1765,1535
522,Denise Dr at Dutton Way,1735,1257
582,Garrett A. Morgan Blvd at Morgan Blvd Station,1710,2523
1094,Riverdale Rd at Heritage Square Apts,1671,507
920,Old Silver Hill Rd at Library,1615,1700
1188,Springhill Ln at Market Ln,1572,761
1147,Silver Hill Rd at Pennsylvania Ave,1561,1447
181,Addison Rd at Walker Mill Rd,1557,1230
451,Cherrywood Ln at Greenbelt Federal Courthouse,1533,2771
1290,Whitehall Square Apts at Community Hall,1525,621
511,Crescent Rd at Gardenway,1523,1287
1018,RUBY LOCKHART BLVD AT CAMPUS WAY NORTH,1523,2231
651,Hanover Pkwy at Prem # 7718,1520,791
533,Dodge Park Rd at Hubbard Rd,1488,724
1189,Springhill Ln at Springhill Dr,1488,1436
736,Lamont Dr at Carrollton Pkwy,1460,1021
1231,Temple Hill Rd at Farmer Dr,1459,1164
40,3209 75th Ave,1416,833
556,Equestrian Center Lot 1,1412,81
699,Indian Head Highway at I-495 South Ramp,1385,68
1175,Southern Maryland Hospital,1358,123
693,Ikea at Bus Bay 2,1355,2571
606,Greenbelt Rd at Opp. Greenbelt Center,1349,1130
646,Hanover Pkwy at Hanover Dr,1348,1202
1294,Wmap Rd at Icesat Rd,1337,1125
1212,Suitland Rd at Huron Ave,1333,1550
1200,St Clair Dr at 28th Ave,1316,1693
967,PG Plaza Station Bus Bay H,1294,130
536,Donnell Dr at Marlboro Pike,1285,466
178,Addison Rd at Ronald Rd,1277,811
741,Lamont Dr at Powhatan St,1274,1316
472,Chillum Rd at Longford Dr,1274,706
663,Hastings Dr at Peppermill Dr,1272,193
968,PG Sports Complex,1267,1408
694,Ikea at Bus Bay 3,1264,80
1211,Suitland Rd at Homer Ave,1255,795
287,Belcrest Rd at 6505 Belcrest Rd,1227,561
318,Branchwood Towers,1186,1654
838,Mattowoman Beantown Rd at MTA Park and Ride Lot,1176,32
70,4106 Whitehall Square Apts,1174,395
610,Greenbelt Road (MD. RTE. 193) at NASA Goddard Main Gate(PM),1166,25
859,Nalley Rd at Capital View Dr,1158,717
1186,Springhill Ln at Breezewood Ct,1153,1158
361,Brinkley Rd at Brinkley Manor W Ent,1151,361
1296,Woody Terrace at Woodyard Road,1145,170
604,Greenbelt Rd at Greenway Center,1138,1404
354,Brightseat Rd at Maple Ridge Apts,1123,1952
385,Brooks Dr at Marlboro Pike,1111,568
22,23rd Ave at Lewisdale Dr,1106,973
1089,Riverdale Rd at 67th Ave,1087,1522
430,Central Ave at Cindy Ln,1083,496
28,28th Ave at Keating St,1076,698
223,Annapolis Rd at Riverdale Rd,1067,511
762,Largo Rd at Black Swan Dr,1051,63
1258,University Blvd at Guilford Rd,1040,108
1244,Temple Hill Rd at Rickey Ave,1038,742
222,Annapolis Rd at Edmonston Rd,1035,718
1184,Springhill Dr at Cherrywood Ln,1021,705
992,Piscataway Rd at Pella Place,1017,1094
367,Brinkley Rd at Huntcrest,1014,1679
1187,Springhill Ln at Breezewood Dr,1005,947
841,Maxwell Dr at Morris Ave,995,1097
291,Belcrest Rd at PG Plaza Sta Entrance,987,1
1050,Riggs Rd at University Blvd,973,288
644,Hanover Pkwy at Greenbrook Dr,963,661
743,Lamont Dr at Westbrook Dr,960,1426
997,Possum Ct at Walker Mill Dr,951,666
1091,Riverdale Rd at Carrollton Mall,948,2235
17,23rd Ave at Amherst Rd,947,297
359,Brinkley Rd at Arborview Entrance,935,236
124,8201 Corporate Dr,931,554
1093,Riverdale Rd at Fountainbleau Dr,925,399
1173,Southern Ave at Wheeler Rd,924,1001
98,5401 85th Ave,915,1064
1251,Timothy Branch Drive @ Safeway,912,1081
1253,Toledo Rd at Adelphi Rd,901,681
1088,Riverdale Rd at 64th Ave,897,351
1201,St George Blvd at Waterfront St,891,1171
748,Landover Rd at 56th Ave,887,463
1227,Temple Hill Rd at Allentown Rd,887,968
923,Old Silver Hill Rd at Parkland Dr,886,361
396,Campus Way North at Grey Gables Ct,883,725
1247,Temple Hill Rd at St Barnabas Rd,874,1221
97,5295 85th Ave,872,640
897,Old Forestville Rd at Forestville Rd,870,2261
626,Gwynn Park High School,870,701
631,Hamilton St at 36th Ave,864,415
1254,Toledo Rd at Belcrest Rd,859,910
1185,Springhill Dr at Springhill Ln,848,1120
245,Auburn Ave at Riverdale Rd,838,2020
348,Brightseat Rd at Evarts St,823,267
100,5600 54th Ave,820,682
1081,Riverdale Rd at 54th Ave,815,354
257,Baltimore Ave at Berwyn House Rd,813,860
329,Brandywine Road @ Northgate Parkway,811,79
1022,Raleigh Rd at Culver St,808,630
475,Cipriano Rd at Brae Brooke Dr,801,821
739,Lamont Dr at Lamont Pl,797,457
429,Central Ave at Cabin Branch Rd,797,26
531,District Heights Pkwy at Rochelle Ave,783,602
73,4138 Whitehall Square Apts - out,783,23
1286,Walker Mill Road at Marlboro Pike,780,1224
1043,Rhode Island Ave at Mt Rainier,780,480
632,Hamilton St at 37th Ave,766,242
728,Kipling Pkwy at Marlboro Pike,758,737
405,Campus Way South at Joyceton Dr,751,386
983,Peppermill Dr at Canyon Dr,750,480
336,Breezewood Dr at Cherrywood Ter,733,692
196,Allentown Rd at Allentown Way,732,1526
1054,Ritchie Rd at Ashville Rd,731,613
1070,Ritchie Rd at Truck Way,731,334
479,Clinton Manor,725,673
340,Brightseat Rd at Ardwick-Ardmore Rd,724,1009
545,East Capitol St at Yost Pl,723,634
683,Hubbard Rd at Martin Luther King,715,607
72,4138 Whitehall Square Apts - in,713,802
759,Lansdowne Village Apts,694,523
865,Nalley Rd at Michele Dr,692,192
260,Baltimore Ave at Cherokee St,688,534
1148,Silver Hill Rd at Randall Rd,683,815
730,Kipling Pkwy at Wintergreen Ave,679,623
1015,Queensbury Rd at Baltimore Ave,679,633
198,Allentown Rd at Camp Springs Ave,678,596
952,Oxon Hill Rd at Riverside Plaza Apts,678,181
1250,Temple Hill Rd at Weldon Dr,677,463
1024,Raleigh Rd at St Barnabas Rd,670,614
387,Brooks Drive at Ridley Street,666,699
277,Baltimore Ave at Queensbury Rd,665,649
1023,Raleigh Rd at Olson St,665,386
630,Hamilton St at 35th Ave,659,438
729,Kipling Pkwy at Ritchie Rd,650,496
818,Manor at Victoria Park,649,571
1243,Temple Hill Rd at Portal Ave,646,802
832,Marlboro Pike at Walters Ln,645,713
1282,Walker Mill Rd at Rochell Ave,645,507
225,Apollo Dr at Lottsford Rd,641,508
611,Greenbelt Station Parkway at S. Center Drive,641,138
645,Hanover Pkwy at Greenway Center Dr,640,213
507,County Service Building,637,520
492,Columbia Park Rd at South Club Dr,636,811
203,Allentown Rd at Old Branch Ave,634,871
812,Madison St at Timber Creek Dr,629,412
1181,Southway at Crescent Rd,626,767
539,Donnell Drive at Target Store,626,1917
931,Owens Rd at Kennebec St,619,721
889,Old Alexandria Ferry Rd at Woodyard Rd,618,709
1242,Temple Hill Rd at Plata St,611,151
1074,Ritchie Station Court Bus Stop #2,605,80
167,Addison Rd Metrorail - Arrival,602,17020
637,Hampton Park Boulevard at Alaking Ct,599,815
793,MLK Jr Hwy at 65th Ave,597,489
314,Bock Rd at Technology Recreation Complex,593,720
1071,Ritchie Rd at Vineyard Dr,591,508
635,Hamilton St at 3900,591,361
855,Morris Ave at Maxwell Dr,584,775
528,District Heights Pkwy at Breton Dr,581,332
67,40plgall_nb,580,219
571,Fisher Rd at St. Moritz Dr,579,610
718,Kanawha St at 15th Ave,577,139
944,Oxon Hill Rd at 6400 Clipper Way,572,6
15,16th Ave at Cypress Creek Dr - in,572,77
1156,Southern Ave at 9th St SE,569,255
554,Elm St at Gov Oden Bowie Dr,562,277
596,Good Luck Rd at Silk Tree Dr,561,84
14,16th Ave at Cypress Creek Dr,561,601
490,Columbia Park Rd at Marshall Pl,561,612
737,Lamont Dr at Donoghue Dr,559,654
640,Hampton Park Boulevard at Hampton Mall Dr,557,570
1096,Riverdale Rd at Tanglewood Dr,556,265
742,Lamont Dr at Quentin St,555,394
548,East-West Hwy at Metro Center Dr,554,1407
991,Piscataway Rd at Old Branch Ave,554,76
1027,Ray Rd at Cypress Creek Dr - in,552,39
25,2400 Chillum Rd,552,462
1028,Ray Rd at Madison St,551,571
939,Oxon Hill Fringe Parking Lot Bus Bay B,550,843
408,Campus Way at PGCC Perimeter Rd,549,1301
862,Nalley Rd at Green Willow Ct,547,438
59,38th St at Shepherd St,541,348
1052,Ritchie Rd at #2918,541,230
489,Columbia Park Rd at Columbia Pl,540,452
614,Greenbrook Dr at Hanover Pkwy,538,612
1142,Sheriff Rd at William Paca School - out,537,220
925,Opposite of Rose Croft Shopping Center,537,437
406,Campus Way South at PGCC Perimeter Rd,536,496
860,Nalley Rd at Crane Pl,535,308
726,Kipling Pkwy at Harwood Rd,531,331
221,Annapolis Rd at Bladensburg Elem. School,530,532
935,Owens Rd at Southern Ave,526,418
84,42nd Ave at Madison St,520,1138
199,Allentown Rd at Coolridge Rd,518,454
668,Highview Pl at Keyworth Ct,518,373
381,Brinkley Rd at Temple Hill Rd,517,678
186,Ager Rd at 29th Ave,513,85
814,Mandan Rd at Canning Terr,513,379
861,Nalley Rd at East Nalley Rd,511,445
64,38th St at Windom Rd,506,310
1127,Sheila Ln at Mike Shapiro Dr,504,124
851,Merrimac St at 14th Ave,503,24
262,Baltimore Ave at East-West Hwy,502,219
590,Good Luck Rd at Cathedral Ave,500,327
647,Hanover Pkwy at Hunting Ridge Club Apts,498,341
777,Largo Rd at Water Fowl Way,497,24
1280,Walker Mill Drive at Shady Glen Drive,496,639
753,Landover Rd at Annapolis Rd,496,470
326,Brandywine Rd at Woodyard Rd,492,147
244,Auburn Ave at Chestnut Ave,492,892
608,Greenbelt Road (MD. RTE. 193) at NASA Goddard Main Gate,490,90
981,Pennsylvania Ave at Penn Crossing Dr,488,1273
831,Marlboro Pike at Upland Ave,487,374
534,Dodge Park Rd at Landover Rd,486,478
321,Brandywine Rd at Cork Tree Way,484,259
1131,Sheriff Rd at Dutch Village Dr,482,745
402,Campus Way South at Central Ave,481,646
427,Central Ave at Bayou Ave,479,421
561,Fairlawn St at Colebrooke Dr,479,747
95,5150 Annapolis Rd,479,348
1203,Stuart Lane at Surratts Road,475,14
71,4112 Whitehall Square Apts,474,1122
20,23rd Ave at Drexel St,474,354
894,Old Branch Ave at Arbutus Ln,473,750
1149,Silver Hill Rd at Suitland Rd,469,469
1126,Sargent Rd at Rollingcrest Commons,468,462
393,CAMPUS WAY NORTH AT LADY GROVE ROAD,467,413
592,Good Luck Rd at Dawnwood Dr,466,605
299,Benning Rd at Drum Ave,466,632
1197,St Barnabas Rd at Raleigh Rd,464,527
801,MLK Jr Hwy at Columbia Park Rd,461,680
169,Addison Rd at Adak St,460,1049
918,Old Pike Way at Dower House Rd,460,372
650,Hanover Pkwy at Ora Glen Dr,459,1206
184,Ager Rd and Oglethorpe St,457,186
600,Greenbelt Metro Dr at Cherrywood Ln,456,968
5,1301 McCormick Dr,456,283
978,Pennsy Drive at Landover Metro Station,456,471
377,Brinkley Rd at Rose Croft Shopping Center,456,462
924,Olson St at Norcross St,454,533
698,Indian Head Highway at Audrey Ln,454,631
953,Oxon Hill Rd at Rivertown Commons(6135),452,432
380,Brinkley Rd at Summerhill Rd,450,301
285,Baltimore Ave at University Blvd,447,458
1266,Valley Trail Ln at Catesby Ct,446,384
46,3404 Dodge Park Rd,445,318
1069,Ritchie Rd at Roslyn Ave,443,656
1298,Woodyard Rd at Canberra Dr,443,136
1210,Suitland Rd at 4412 Suitland Rd,441,867
509,Coventry Way at Old Alexandria Ferry Rd,440,624
566,Fisher Rd at Clow Ct,440,457
16,23rd Ave at  Beechwood Rd,439,97
722,Kipling Pkwy at Brewton St,439,415
1154,Southern Ave at 13th St SE,439,328
1246,Temple Hill Rd at Spring Ter,435,286
853,Mike Shapiro Dr at Sheila Ln,435,466
495,Columbia Park Rd at Virginia Ave,434,170
267,Baltimore Ave at Hartwick Rd,434,213
1066,Ritchie Rd at Ritchie Dr,432,652
292,Belcrest Rd at Queens Chapel Rd,432,353
18,23rd Ave at Banning Pl,429,196
1026,Ray Rd at Cypress Creek Dr,427,503
530,District Heights Pkwy at Marbury Ct (W),426,359
565,Fisher Rd at Brinkley Station Dr,426,354
224,Apollo Dr at Arena Dr,425,502
428,Central Ave at Brightseat Rd,425,515
471,Chillum Rd at Buchanan St,423,161
32,28th Pkwy at Afton St,420,124
1012,Queensbury Rd at 44th Ave,420,383
945,Oxon Hill Rd at John Hanson Ln,418,482
912,Old Marlboro Pike at Roblee Dr,416,338
885,Old Alexandria Ferry Rd at Highland Meadows Dr,415,338
878,OXON HILL FRINGE PARK AND RIDE LOT AT BUS BAY F,415,26
379,Brinkley Rd at Shopton Pl,415,294
464,Cheverly Ave at Montrose Rd,412,370
815,Mandan Rd at Greenbelt Rd,409,323
811,Madison St at Ray Rd,409,42
327,Brandywine Road @ Groveton Drive,406,60
1063,Ritchie Rd at Napier Dr,404,279
809,MONUMENT AVE @ MGM CASINO,404,1173
826,Marlboro Pike at Melwood Mall,404,432
1164,Southern Ave at Greater SE Hospital,402,179
330,Brandywine Road @ Surrats Road,400,210
1269,Village Dr West at Clairfield Ln,399,43
833,Marlboro Pike at Whitney Pl,399,50
1278,WILSON BRIDGE DRIVE,398,397
504,County Rd at Elmhurst St,398,1069
560,Fairlawn St at 28th Pkwy,397,79
823,Marlboro Pike at Kipling Pkwy,396,415
1039,Rhode Island Ave at Bunker Hill Rd,394,126
1249,Temple Hill Rd at Temple Hills Trailer Pk,394,75
527,District Heights Pkwy at Addison Rd S,394,183
840,Maxwell Dr at Allentown Rd,393,261
1165,Southern Ave at Gunther St,390,78
1241,Temple Hill Rd at Piscataway Rd,390,365
708,Jericho Residences (Southbound),387,351
335,Breezewood Dr at Cherrywood Ln,386,561
847,McCormick Dr at UMUC,385,235
883,Old Alexandria Ferry Rd at Bellefonte Ln,385,350
1056,Ritchie Rd at D'arcy Rd,385,355
1102,Rollins Ave at District Ave,384,272
241,Auburn Ave at 1st St,369,397
664,Hastings Dr at Valley Park Rd,368,273
541,Dunmore Pl at Edgeworth Dr,368,912
961,PALMER ROAD & INDIAN HEAD HIGHWAY,365,297
113,7600 Riverdale Rd,365,180
89,4412 Suitland Rd (Opposite),364,432
1229,Temple Hill Rd at Cardwell Dr,363,145
884,Old Alexandria Ferry Rd at Heflin Dr,362,361
1003,Queens Chapel Rd at Hamilton St,361,862
30,28th Ave at Kenton Pl,361,604
302,Bladensburg Rd at 38th St,359,389
1095,Riverdale Rd at Mahoney Dr,358,250
220,Annapolis Rd at 85th Ave,355,1713
696,Indian Head Highway (MD. RTE. 210) at Southern Ave,354,362
951,Oxon Hill Rd at Oxon Hill Plaza(6201),354,205
271,Baltimore Ave at Knox Rd,354,594
114,7602 Riverdale Rd,352,485
47,3417 Dodge Park Rd,350,399
523,Denise Dr at Epworth Way,350,315
962,PALMER ROAD & OLD PALMER ROAD,350,252
679,Hillside Rd at Northway,349,280
397,Campus Way North at St Joseph's Dr,347,92
863,Nalley Rd at Kaplan Ct,347,120
1172,Southern Ave at UNITED MEDICAL CENTER,347,79
136,9400 Peppercorn Pl,346,483
1240,Temple Hill Rd at Old Temple Hill Rd,346,297
99,54th Ave at Jefferson St,343,453
261,Baltimore Ave at Cherry Hill Road,342,641
23,23rd Ave at Sheridan St,341,351
239,Ashwood Dr at Ritche Rd,340,150
521,Denise Dr at Banister Way,339,170
813,Mandan Rd at 7648 Mandan Rd,338,425
1304,Zachery St at Lottsford Rd,338,54
473,Chillum Rd at Queens Chapel Rd,338,288
567,Fisher Rd at Damian Dr,338,320
13,15th Ave at University Blvd,336,817
654,Hanover Pkwy at Village Park Dr,335,238
201,Allentown Rd at Karen Anne Dr,335,375
211,Allentown Rd at Westchester Ct,334,539
921,Old Silver Hill Rd at Parkland Ct (E),334,807
1062,Ritchie Rd at Mane Ln,332,515
1065,Ritchie Rd at Putnam Ln,331,335
585,Goddard Space Flight Center Main Gate (Northbound),327,402
510,Crescent Rd at 58 Court,327,61
773,Largo Rd at Largo Landing,326,274
908,Old Marlboro Pike at Melwood Rd,326,207
1036,Rhode Island Ave at 42nd Pl,324,371
700,Indian Head Highway at Southern Ave,323,466
263,Baltimore Ave at Erie St,323,284
195,Allentown Rd at 5711 AFCU Allentown Rd,323,296
802,MLK Jr Hwy at Glen Willow Dr,320,259
1284,Walker Mill Rd at Tanow Pl,319,120
1104,Rollins Ave at Rollins Ln,318,269
215,Annapolis Rd at 48th St,317,357
78,425 Brightseat Rd,317,114
877,OLD BRANCH AVENUE & ALLENTOWN WAY,314,85
1202,Stars Entrance Gaylord Hotel at National Harbor Blvd,310,791
529,District Heights Pkwy at Marbury Ct (E),309,116
727,Kipling Pkwy at Marbury Dr,309,244
1145,Silver Hill Rd at Parkway Terrace Dr,308,145
68,40th Pl at Crittenden,308,229
959,PALMER ROAD & DEVON HILLS DRIVE,307,225
75,4192 Whitehall Square Apts,306,2462
185,Ager Rd at 23rd Ave,305,271
1204,Stuart Ln at Topaz Court,304,130
615,Greenbrook Dr at Ora Glen Dr,304,258
707,Jericho Residences,304,244
238,Ashwood Dr at Dunmore Pl,303,947
764,Largo Rd at Buck Ln,302,397
1125,Saint Barnabas Rd at John Hanson Ln,302,132
500,Council Dr at Kipling Pkwy,300,100
655,Harry S Truman Dr at Birdie Ln,300,375
660,Harry S. Truman Dr at Lottsford,299,112
328,Brandywine Road @ Killarney Street,299,42
569,Fisher Rd at Heather Hill,298,327
1138,Sheriff Rd at Harvey Dr,298,353
1235,Temple Hill Rd at Kirbywood St,298,299
76,4205  Suitland Rd,298,396
468,Chillum Rd at 18th Ave - in,296,27
1234,Temple Hill Rd at Henderson Rd,295,310
52,38th St at Allison St,295,127
1160,Southern Ave at C St,295,347
410,Capitol Heights - Arrival,294,6365
305,Bladensburg Rd at 41st Ave,294,191
1171,Southern Ave at Southview Dr,293,372
506,County Rd at Valley Brook Apts,293,174
716,Judge's Dr at Pratt St,292,2460
871,New Carrollton Station - Arrival,292,19110
375,Brinkley Rd at Morton Place,292,195
1010,Queensbury Rd at 41st Ave,290,292
1137,Sheriff Rd at Glen Willow Dr - South Side,290,52
431,Central Ave at Daimler Dr,290,228
549,East-West Hwy at Toledo Ter,288,733
1053,Ritchie Rd at Alberta Dr,288,407
1073,Ritchie Station Court Bus Stop #1,287,1048
301,Bishopmill Dr at Village Dr West,285,57
643,Hanover Pkwy at Greenbelt Rd,285,260
719,Kenilworth Ave at Nicholson St,283,593
248,Auth Rd at Carswell Ave,283,282
703,Jefferson St at Kenilworth Ave,283,757
107,60th Ave at Greenbelt Rd,281,140
1110,SOUTHERN AVENUE & CHESAPEAKE STREET SE,280,166
289,Belcrest Rd at PG Plaza Entrance,279,2389
303,Bladensburg Rd at 40th Ave,278,482
807,MLK Jr Hwy at Sheriff Rd,278,317
275,Baltimore Ave at Oglethorpe St,278,239
1170,Southern Ave at Premisies 800 (Park Southern Apts),277,302
514,Crescent Rd at Ridge Rd,276,400
790,Lottsford Rd at Zachery St,274,596
691,INDIAN HEAD HWY AT FORT WASHINGTON MANOR SENIOR RESIDENCES,273,367
1169,Southern Ave at Park Southern Apts,272,395
446,Central Ave at Yeoman Pl,272,137
315,Bock Rd at Wolf St,271,58
776,Largo Rd at Town Farm Rd,270,244
1158,Southern Ave at Barnaby Road,270,203
58,38th St at Perry St,268,291
350,Brightseat Rd at Glen Valley Dr,268,135
747,Landover Rd at 55th Ave,268,302
364,Brinkley Rd at Farmer Dr,267,243
360,Brinkley Rd at Brinkley House W Ent,267,985
1245,Temple Hill Rd at Santeetlah Dr,265,478
633,Hamilton St at 38th Ave,265,551
368,Brinkley Rd at Huntley Square Dr,264,1084
1157,Southern Ave at B St SE,263,196
191,Ager Rd at Oglethorpe St,262,437
578,Gallatin St at 43rd Ave,262,324
661,Harvey Dr at Sheriff Rd,262,83
259,Baltimore Ave at Campus Dr,259,43
998,Prince George's Plaza - Arrival,257,1351
963,PALMER ROAD & POTOMAC HEIGHTS DRIVE,257,51
202,Allentown Rd at Kingston Dr,256,346
109,60th Ave at Seminole St,256,161
376,Brinkley Rd at Roberts Dr,255,205
1194,St Barnabas Rd at Hagan Rd,255,86
1174,Southern Ave opposite B St SE,255,137
1237,Temple Hill Rd at Lambert Dr,255,176
300,Benning Rd at Southern Ave,253,312
564,Fieldstone Way,251,118
334,Brandywine Road at Surrats Road,250,475
1075,Ritchie-Marlboro Rd & Sansbury Rd,250,381
205,Allentown Rd at Opp. Leon St,249,125
778,Largo Rd at Watkins Park Dr,249,572
836,Matapeake Business Dr at Target Store (opposite),248,237
1274,Village Green Dr at Belle Haven Dr,247,85
1276,Volta Ave at 39th Pl,246,61
1177,Southern Rd at Wheeler Rd,244,182
1090,Riverdale Rd at 67th Pl,244,149
943,Oxon Hill Rd at 6246 Oxon Hill Rd,243,397
1017,Queensbury Rd at Rhode Island Ave,243,133
29,28th Ave at Keith St,242,259
280,Baltimore Ave at Rossborough Ln,242,325
213,Allentown Way at Allentown Rd,242,419
941,Oxon Hill Rd at 6192 Oxon Hill Rd,241,501
12,14th Ave at Langley Way,241,370
1105,Rollins Ave at Upcot Ct,240,103
796,MLK Jr Hwy at Booker Dr,239,122
105,5846 ALLENTOWN WAY,239,713
7,1380 Southern Ave,239,196
1013,Queensbury Rd at 44th Pl,239,439
792,MERCANTILE LN AT TECHNOLOGY WAY,239,151
448,Chatsfield Way at Palmerton Ter,238,99
938,Owens Rd at Woodland Blvd,238,347
678,Hillside Rd at Laurel Hill Rd,237,381
209,Allentown Rd at Waldran Ave,237,204
249,Auth Rd at Clacton Ave,236,208
399,Campus Way S at Prince Place,235,111
547,East Swan Creek at Indian Head Hwy,235,206
642,Hanover Pkwy at Green Manor Ct,234,178
771,Largo Rd at Kettering Dr,234,80
268,Baltimore Ave at Hollywood Rd,234,266
390,CAMPUS WAY AT NORTH AT ST. JOSEPHS DRIVE,233,360
1267,Valley Trail Ln at Romford Dr,233,192
990,Piscataway Rd at Hardesty Dr,233,131
391,CAMPUS WAY NORTH AT BYWARD BLVD,232,164
1155,Southern Ave at 6th St SE,231,245
629,Hamilton St at 31st Ave - in,230,1041
69,40th Pl at Gallatin St,230,274
269,Baltimore Ave at Indian Ln,230,163
351,Brightseat Rd at Glenarden Pkwy,228,255
589,Goddard Space Flight Center Visitors Center (Southbound),228,198
503,County Rd at Belwood St,226,262
933,Owens Rd at Norlinda Ave,226,188
104,5805 Queens Chapel Rd,225,250
634,Hamilton St at 38th St,224,251
680,Hillside Rd at Research Rd,224,107
766,Largo Rd at Drumsheugh Ln,223,22
135,8951 Lottsford Rd (opposite),222,82
553,Edgeworth Dr at Ritchie Rd,222,218
1238,Temple Hill Rd at Megan Dr,221,231
1097,Riverdale Rd at Taylor Rd,219,102
1001,Quebec St at 58th Ave,219,170
512,Crescent Rd at Lastner Ln,218,514
1128,Sheriff Rd at Belle Haven Dr,216,570
307,Bladensburg Rd at 43rd Ave,216,222
797,MLK Jr Hwy at Cabin Branch Dr,215,150
217,Annapolis Rd at 53rd St,214,347
494,Columbia Park Rd at Stanford Pl,213,103
986,Peppermill Dr at Pepper St,213,221
34,28th Pkwy at Duggan St,213,96
625,Gwendolyn Britt Center,212,252
886,Old Alexandria Ferry Rd at Malcolm Rd,212,112
1040,Rhode Island Ave at County Service Building - NB,211,215
586,Goddard Space Flight Center Main Gate (PM Southbound),210,178
108,60th Ave at Quebec St,209,112
272,Baltimore Ave at Lakeland Rd,209,452
942,Oxon Hill Rd at 6201 Oxon Hill Plaza,208,424
53,38th St at Bunker Hill Rd,207,752
31,28th Pkwy at 27th Ave,205,290
971,PGCC Perimeter Rd at Child Care Facility,205,165
1057,Ritchie Rd at Dennis Ct,205,173
189,Ager Rd at Nicholson,205,44
864,Nalley Rd at Michele Ct,204,847
435,Central Ave at Norair Ave,204,207
1045,Rhode Island Ave at Volta Ave,203,215
666,Highview Pl at Brooke Rd,203,141
607,Greenbelt Rd at Walker Dr,203,205
794,MLK Jr Hwy at 69th Pl,202,176
1167,Southern Ave at Opposite 1380 Southern Ave,202,203
1208,Suitland Metro - Arrival,201,13366
170,Addison Rd at Adel St,201,40
24,23rd Ave at Woodberry St,201,393
926,Ora Glen Dr at Mandan Rd,201,203
273,Baltimore Ave at Longfellow St,200,89
281,Baltimore Ave at Sheridan St,198,60
803,MLK Jr Hwy at Greig St,198,304
1255,Truman Manor,198,168
623,Greenway Center (PM Northbound),198,255
460,Cheverly Ave at Forest Rd,197,115
1064,Ritchie Rd at Overton Dr,197,214
1265,Valley Trail Ln at Bain Dr-West,196,209
298,Benning Rd at Abel Ave,195,78
304,Bladensburg Rd at 40th Pl,195,98
461,Cheverly Ave at Inwood St,195,208
858,Mt Rainier Terminal - Arrival,195,2683
1085,Riverdale Rd at 61st Pl,194,144
638,Hampton Park Boulevard at East Hampton Dr,194,375
1055,Ritchie Rd at Central Ave,193,839
891,Old Branch Ave at 6811 Old Branch Ave (Opposite),193,67
306,Bladensburg Rd at 42nd Ave,192,100
767,Largo Rd at Eton Dr,192,319
228,Ardwick-Ardmore Rd at MLK Jr Hwy,191,278
177,Addison Rd at James Farmer Way,191,262
1049,Ridgefield Blvd at Stretford Ct,191,61
1228,Temple Hill Rd at Badger Ave,190,54
1263,Upshur St at 30th St,189,163
265,Baltimore Ave at Hamilton St,189,198
1132,Sheriff Rd at Dutch Village Dr - out,189,126
1004,Queens Chapel Rd at Lancer Dr,189,194
789,Lottsford Rd at McCormick Dr,188,532
365,Brinkley Rd at George Washington Dr,188,68
763,Largo Rd at Brock Rd,187,33
83,42nd Ave at Jefferson St,187,136
74,414 Brightseat Rd,186,212
848,McCormick Dr at UMUC (opposite),186,251
204,Allentown Rd at Opp. 5711 AFCU Allentown Rd,185,207
749,Landover Rd at 57th Ave,185,74
149,ALLENTOWN ROAD & LANHAM LANE,184,52
993,Pontiac St at 60th Ave,184,225
901,Old Marlboro Pike at Brooklee Dr,183,122
520,Davey St at Urey Pl,183,172
